id,title,final_price,rating,image
23975795449,[Mã SPHACL9 giảm 7% đơn 500K] Chuột chơi game không dây Hyperwork Helios GM01 - Hàng chính hãng,1590000,4.86,https://down-vn.img.susercontent.com/file/vn-11134207-7r98o-llhcpbwhji5yca_tn
16690323024,"COMBO 3 QUẦN  100K, Quần Short Quần Đùi Nam Kate Caro,,khóa kéo 2 bêm túi ,size từ 40-90kg",119999,4.81,https://down-vn.img.susercontent.com/file/sg-11134201-22110-7qkyhjbor9jv49_tn
29955351324,Louiswill Nam Ba Lô Hợp Thời Trang Stylist Laptop Notebook Ba Lô Du Lịch Chống Nước Ba Lô Túi Kinh Doanh Ba Lô Đại Học Túi Đeo Vai Thường Ngày Chống Trộm Lại Túi Đi Học Dành Cho Nam,376920,2.0,https://down-vn.img.susercontent.com/file/cn-11134207-7r98o-lxqn3i3ndp39f6_tn
23980796531,"Decal Trang Trí Tiệm Nail, Mi, Uốn Tóc, Phun Xăm Chống Nước 🌈𝑭𝒓𝒆𝒆𝒔𝒉𝒊𝒑 Decal Dán Tường, Kính Menu Hồng Lấp Lánh",12500,5.0,https://down-vn.img.susercontent.com/file/vn-11134207-7r98o-llvjrwiapwinb1_tn
23972875015,Miếng Đệm Bảo Vệ Gót Chân Giúp Giảm Đau Tiện Dụng,13847,4.82,https://down-vn.img.susercontent.com/file/sg-11134201-7qvfx-livg2xjdpfb5a4_tn
5132299015,Nhớt tổng hợp gốc Ester Motul 7100 10W50,290000,4.83,https://down-vn.img.susercontent.com/file/vn-11134207-7ra0g-m78s9tvgfho339_tn
23927169461,Hộp pin tiểu Maxell AA (1.5V) Super Power Ace - Pin tiểu 2A Maxell - Hàng chính hãng,112000,4.99,https://down-vn.img.susercontent.com/file/vn-11134207-7ras8-m1rwtsanzas391_tn
29061946202,[HB Gift] Ly giữ nhiệt Colgate trắng,500000,4.9,https://down-vn.img.susercontent.com/file/vn-11134207-7ras8-m13mez47d5az7d_tn
29100353309,"Android TV Box,Bluetooth tần số đôi kết nối wifi 5G Phiên Bản Plus Hỗ trợ điều khiển bằng giọng nói,Xem mượt mà YouTube",579000,4.86,https://down-vn.img.susercontent.com/file/vn-11134207-7ras8-m0igo9jsq7sd0c_tn
26260392199,"máy ép trái cây điện cầm tay,Cốc nước ép trái cây nhỏ có thể sạc lại,Máy xay sinh tố cầm tay dung tích 480ml",125000,5.0,https://down-vn.img.susercontent.com/file/vn-11134207-7r98o-lzu4mi9dn39p18_tn
21370355483,Găng Tay Bảo Hộ Lao Động 3M cấp độ 5 size L,140000,5.0,https://down-vn.img.susercontent.com/file/sg-11134201-23010-5zprr6f21ulv00_tn
25631200335,"Máy Xay Sinh Tố Đa Năng KAW SILVER CREST SC-1589 Máy Xay Công Nghiệp 2 Đa năng xay đá,xay thịt cá thực phẩm",539000,5.0,https://down-vn.img.susercontent.com/file/vn-11134207-7r98o-lvo6poz1jybdfa_tn
5842386617,"Click Omron TTC chuột Rival 500 Rival 650 Rapoo 3300 3600 Mad catz Rat 1, nút click bên hông chuột Razer Naga Hexagram",17500,5.0,https://down-vn.img.susercontent.com/file/e37f9b6b976dfbe2c840ce78809d58ba_tn
9921698874,Son Kem Colourpop Lux Velvet Liquid Lipstick màu puddin' lux liquid lip (Có Sẵn - Bill Mỹ),139000,5.0,https://down-vn.img.susercontent.com/file/87fd465e81eb880cffba311d735ec2d0_tn
19769485085,Thùng 4 Gói Tã/Bỉm Quần OLOLA Camel Đủ Size Dùng Ban Đêm Chống Tràn L/XL/XXL Tối Ưu Phí Vận Chuyển,1680000,4.97,https://down-vn.img.susercontent.com/file/sg-11134201-7rd5e-lwn603758opo7b_tn
29911465981,[tặng tất🎁]Giày bóng chuyền cổ cao A.S.I.C.S BEYOND nữ đủ màu-chất lượng cao-siêu êm-nhẹ-đế cao su bền bỉ-bám sân tốt,629000,4.86,https://down-vn.img.susercontent.com/file/vn-11134207-7ras8-m3f4ch9qnmsh38_tn
9141825632,"Đồ chơi xếp hình, lắp ráp Qman 1411 - Tàu tuần dương biển (700 mảnh ghép)",379000,5.0,https://down-vn.img.susercontent.com/file/vn-11134207-7qukw-lgf1jk7rg7w709_tn
21293017715,"Ấm Siêu Tốc Đạt Tường Hàng Chính Hãng Nhanh Sôi , Ấm Siêu Tốc Đạt Tường DL-04/DL-05/DL-09 Chất Liệu Inox 304",265000,5.0,https://down-vn.img.susercontent.com/file/vn-11134207-7r98o-m01vzzdb9le7e0_tn
25928593867,"Bôi kích nhanh ra mỏ hàng nhập khẩu Thái Lan cao cấp.Hiệu quả,dùng cho gà gãy mỏ hụt mỏ hoặc bị bay mỏ",29500,4.71,https://down-vn.img.susercontent.com/file/vn-11134207-7r98o-luxo0vhrcwsyaa_tn
26460421590,"Máy sấy tóc ion âm- không cánh 3 tốc độ, công suất mạnh, làm khô nhanh, tiết kiệm điện năng, bảo vệ tóc khỏi hư tổn",320000,5.0,https://down-vn.img.susercontent.com/file/vn-11134207-7ras8-m0vbmcha7u253e_tn
3531531357,Vợt cầu Lông VICTOR / YN chính hãng khung Cacbon (TẶNG 1 LẦN CĂNG CƯỚC VÀ QUẤN CÁN),289000,4.82,https://down-vn.img.susercontent.com/file/2353fd336d2dcb5d46b90fc71d7b3ba9_tn
13616701243,Nồi cơm điện tử Toshiba 1.8 lít RC-18DH2PV(W) hàng trưng bầy 98 99% chính hãng 100%,1190000,5.0,https://down-vn.img.susercontent.com/file/aa849eb979b4a49ea26a3107b0651a18_tn
26925700781,"Chai Xịt Lạnh Giảm Đau Siêu Tốc Anpha Gold - Giảm Sưng Đau, Bong Gân Do Hoạt Động, Tụ Máu, Bầm Tím",500000,5.0,https://down-vn.img.susercontent.com/file/vn-11134207-7ras8-mbura9h0pcoi3e_tn
7418027519,Rơ le - role cọc dài 20cm - 26cm bình nóng lạnh Ariston có bảo hành,145000,4.91,https://down-vn.img.susercontent.com/file/vn-11134207-7r98o-m07id0zp52p9cf_tn
29356423900,"Bánh Táo Đỏ Óc Chó Chà Là, Bánh Táo Đỏ Không Đường Ăn Kiêng - Chị7FOOD",88000,4.94,https://down-vn.img.susercontent.com/file/vn-11134207-7r98o-ly89j3xpfqu947_tn
21289674277,Máy rửa rau củ quả Lydsto HD-ZNGSQXJ02 khử khuẩn thực phẩm bằng công nghệ ion lọc - Bảo hành 12 tháng,639000,4.88,https://down-vn.img.susercontent.com/file/vn-11134207-7r98o-luk3zlvzs6qa5c_tn
24076756099,Máy làm đầy Truffle 3 đầu phun Máy làm xúc xích nhồi thực phẩm bằng thép không gỉ,69300,4.61,https://down-vn.img.susercontent.com/file/d75fbfc0ce22fc4f68a9526dec269044_tn
9543673100,Kính cường lực Samsung A15 A14 A24 A25 A13 A34 A32 A05 A04 A73 A52 A72 M15 A06 A12 A03 A51 A53 A71 A11 A70 A20 A30 A50,9900,4.72,https://down-vn.img.susercontent.com/file/vn-11134201-23020-zybknyn9y2nv56_tn
18189912822,Máy Xay Nấu Đa Năng-Máy Làm Sữa Hạt Cao Cấp Model H1-H2 600ml-750W Chính Hãng KALPEN,1155000,4.94,https://down-vn.img.susercontent.com/file/vn-11134207-7ras8-mcbu5777wwn955_tn
10260136316,"Bàn là hơi Xiaomi Mijia MJGTJ01LF, gọn nhẹ 5 lỗ thoát khí chuyên dụng, ủi phẳng quần áo siêu nhanh",700000,4.93,https://down-vn.img.susercontent.com/file/vn-11134207-7r98o-lstn63obco7t5d_tn
24456339362,"Máy Ép Bánh Mì Pate YiLi Y2688, Máy Kẹp Nướng Bánh Mì, Máy Nướng Ép Bánh Mì Bảo Hành 12 Tháng",869000,4.78,https://down-vn.img.susercontent.com/file/vn-11134207-7r98o-lyndj1m5mf1d92_tn
29004237441,"Dép nam quai ngang dép đúc  DW đơn giản, trẻ trung",70560,5.0,https://down-vn.img.susercontent.com/file/vn-11134207-7r98o-ly0ocxdqa7dn41_tn
25983730400,[Frendyest.vn] Túi đựng vỏ cứng di động cho hộp đựng bàn phím cơ G913,324500,5.0,https://down-vn.img.susercontent.com/file/sg-11134201-7rdx7-lxxidrb3xwso81_tn
18794426356,Máy Xay Sinh Tố WMF Mix & Go Inox18/10 Màu Bạc Nắp Nhựa Đen Với Bình Nước Cầm Tay Xay Sinh Tố Hoa Quả Đựng Nước Sữa,950000,4.73,https://down-vn.img.susercontent.com/file/vn-11134211-7r98o-logchn5a9lmf6e_tn
21392146370,"Diệt gián Nhật Bản hộp 12 viên Barracks Cap, Viên diệt gián sinh học an toàn, hiệu quả, nhanh chóng",45000,4.7,https://down-vn.img.susercontent.com/file/vn-11134207-7r98o-lkoo4ro9egh628_tn
23927255629,[Rẻ vô địch] [Ảnh thật] Chân loa cao su có lông đền sắt,10000,4.92,https://down-vn.img.susercontent.com/file/sg-11134201-23020-t45htll0kxnvfe_tn
22746010122,Máy giặt tự động 2 trong 1 dùng trong gia đình phòng thuê nhà chung cư ký thúc xa thích hợp cho người lười,2400000,5.0,https://down-vn.img.susercontent.com/file/vn-11134207-7r98o-lu8y6b1b8sgh29_tn
18288039288,Microsoft Surface Laptop 2 Nhập Khẩu Mỹ 13.5' Nhiều phiên bản cấu hình Kèm sạc chính hãng Playmobile,10890000,5.0,https://down-vn.img.susercontent.com/file/vn-11134207-7qukw-lfxn4uek998737_tn
23981435475,Lens SEED 1 ngày màu Base Make full dãy độ từ 0 đến -12 độ (1 chiếc lẻ/1 bên mắt) - Buddy Central,29900,4.96,https://down-vn.img.susercontent.com/file/vn-11134207-7ras8-m2dg4063va9g6c_tn
23849247118,Thảm lót chân sàn VISION 2021->2023 Loại Dày mẫu kiểu indo,82680,4.11,https://down-vn.img.susercontent.com/file/sg-11134201-7qvdz-ljkxc38ismpq9b_tn
29009450683,Đèn Năng Lượng Mặt Trời LED Đèn 800W Cảm Biến Ngoài Trời Dường Năng Đèn IP67 Điều Khiển Từ Xa,409000,4.81,https://down-vn.img.susercontent.com/file/vn-11134207-7ras8-m64umjhdy3ure7_tn
25307595042,20000PA Máy hút bụi cầm tay mạnh mẽ ướt và khô với máy hút bụi cầm tay không dây bộ sạc USB,340000,5.0,https://down-vn.img.susercontent.com/file/vn-11134207-7ra0g-macggix8ngsh06_tn
231356963,Tẩy bồn cầu - Gói 10 viên tẩy bồn cầu khử mùi diệt khuẩn (TBC01) bibi90,14000,4.77,https://down-vn.img.susercontent.com/file/1cddfec4e0c8ec6951346653755829cb_tn
22780311718,Nồi Gang Nắp Bằng Chữ B Cao Cấp Size 18cm đến 38cm,211500,4.94,https://down-vn.img.susercontent.com/file/vn-11134207-7r98o-lx1x3kzexejf20_tn
25233598994,Kẹo dẻo nhân kem sữa chua Hartbeat Chews Thái Lan vị trái cây hộp 12 gói,69000,5.0,https://down-vn.img.susercontent.com/file/vn-11134207-7r98o-lxtiikl7zopl8e_tn
10811856241,"Dụng Cụ Kẹp Càng Cua Càng Ghẹ ,tách các Hạt Khô cứng INOX 304 Tiện Ích - dụng cụ nhà bếp",89000,4.91,https://down-vn.img.susercontent.com/file/74e1b5e1d9461e9cba39b0de7823a68d_tn
22579287343,Khăn quàng cổ vuông in hình nữ mới độc đáo 70CM (2755 inch) Khăn lụa thương hiệu sang trọng Mô phỏng lụa tiếp viên Khăn vuông văn phòng Khăn choàng nữ Bán buônB WJ1026,27000,4.91,https://down-vn.img.susercontent.com/file/sg-11134201-7rblr-llagr6utaflt53_tn
29304606486,Cáp sạc USB / Type C Dây sạc từ tính cho Samsung Galaxy Fit 3 R390,30800,4.96,https://down-vn.img.susercontent.com/file/sg-11134201-7rdw3-lxcep7u3zex842_tn
24034197714,[Combo 5 Đôi] Găng Tay Chống Nắng Chống UV UPPER YOU Không Xỏ Ngón Tay Thun Lạnh Và Co Giãn 4 Chiều - OTK02,138000,4.97,https://down-vn.img.susercontent.com/file/vn-11134207-7r98o-lydrubw3ka0187_tn
9132475737,( Date mới) Combo Bỉm quần Nanu baby đủ size 100 miếng S100/ M100/ L100/XL100/ XXL100,350000,5.0,https://down-vn.img.susercontent.com/file/3c636f3a4f378d4a341d4630b7c13c59_tn
23700020037,Bao Da Zippo Chất Liệu Da Bò Cao Cấp ZB1 Hoàn Thiện Thủ Công 4 Màu BH 3 Năm,129000,4.84,https://down-vn.img.susercontent.com/file/vn-11134207-7r98o-lmagdckfukm766_tn
23941883514,Đồng hồ cát chơi board game 30S / 1 / 2 / 3 / 5 / 10 phút giá rẻ nhất B4KIDS,15000,4.92,https://down-vn.img.susercontent.com/file/vn-11134207-7qukw-lgke1wuz254acd_tn
23974167741,Mô Đun Cấp Nguồn Pcbfun 14-60inch 5v-24v,57200,4.87,https://down-vn.img.susercontent.com/file/sg-11134201-7qvdz-ljv2jf6dsiym48_tn
14496766921,Combo Kem Đánh Răng CREST Bản Nội Địa Trung Chính Hãng,15000,4.86,https://down-vn.img.susercontent.com/file/vn-11134207-7qukw-lj4tlytpk53m29_tn
24310645196,"Set áo sơ mi kèm chân váy 2 tầng, áo tay phồng chiết eo tiểu thư xixeoshop - S89",149000,4.84,https://down-vn.img.susercontent.com/file/vn-11134207-7ras8-m14gycu27ereeb_tn
1600620445,"✨ Túi chống sốc MÚT DÀY VẢI MỊN, SIÊU ÊM 10 -> 17 inch- Hàng tận xưởng",31000,4.9,https://down-vn.img.susercontent.com/file/vn-11134207-7r98o-lu92vztfuzof3c_tn
27562929219,[10kg 20kg 30Kg - Tài Lộc] Hũ Đựng Gạo Không Tráng Men Bát Tràng Cao Cấp,448000,4.89,https://down-vn.img.susercontent.com/file/vn-11134207-7ras8-m0vide8012mn68_tn
16795189199,"Máy hút bụi cầm tay không dây Supor C10 Pro hút bụi kèm lau nhà, hút tóc, bụi mịn cực sạch công suất 250W",5990000,5.0,https://down-vn.img.susercontent.com/file/vn-11134207-7r98o-lm70vao576qn02_tn
28320321209,Giấy rút treo tường Caitong 1580 tờ [COMBO 4 BỊCH - TẶNG 1 MÓC TREO] - Hàng nội địa Trung Quốc,109900,4.96,https://down-vn.img.susercontent.com/file/vn-11134207-7ras8-m3n4f6dr3m019d_tn
29509797132,Bàn Là Hơi Nước Cầm Tay HuynDai - Bàn Ủi Hơi Nước - Công Suất 1500W - Bảo Hành 24 Tháng,595000,5.0,https://down-vn.img.susercontent.com/file/vn-11134207-7r98o-lzm3mbhbcnkdc5_tn
3548592085,"[Chính Hãng] Ngăn Xửng Hấp Inox 430 Size 24, 26, 28, 30, 32 VIETCOOK hấp xôi, thực phẩm, đồ xôi inox",284000,4.88,https://down-vn.img.susercontent.com/file/f35d71852d152030b2b1f542ee6ac45c_tn
22442440461,Quạt lọc không khí và khử khuẩn U ULTTY BB,7700000,4.88,https://down-vn.img.susercontent.com/file/vn-11134207-7ra0g-m91h4vm5w2vb91_tn
19644948499,Máy Khoan Bê tông 3 chức năng hukan K90,999000,4.83,https://down-vn.img.susercontent.com/file/vn-11134207-7ras8-m29ppcf0elki3a_tn
25950626418,[ckm19] Thìa xẻng muôi thủng Chockmen ckm19/19t/20 inox316,145000,5.0,https://down-vn.img.susercontent.com/file/vn-11134207-7ras8-m2hv3r5nchx09b_tn
24933901360,Trẻ Em Hồng Barrettes 50 Chiếc Kẹp Tóc Dễ Thương Phù Hợp Với Hoạt Hình Phụ Kiện Tóc Cô Gái Quà Tặng,137756,4.63,https://down-vn.img.susercontent.com/file/sg-11134201-7rdy8-lyemej436ucob0_tn
5320988054,[ CHÍNH HÃNG ] - Xịt tạo phồng tóc Reuzel Spray Grooming Tonic,349000,5.0,https://down-vn.img.susercontent.com/file/vn-11134207-7r98o-lnwzdv0felf175_tn
25251310625,Nhóm Nữ Phong Cách Mèo Móng Vuốt Hoa Hướng Dương Lông Mi Giả Nữ Siêu Nhiên Dung Tích Lớn 10 Hàng Dày Phân Đoạn Ba Phần,28080,4.91,https://down-vn.img.susercontent.com/file/sg-11134201-7rd6i-m7i3meinge9h7e_tn
23624151056,[Hàng chính hãng] Động cơ máy giặt Panasonic cửa trên NA-FD85/ NA-FD95/ NA-FD10/ NA-FD11/ NA-FD12 _ AXW401-5D6A0,650430,4.69,https://down-vn.img.susercontent.com/file/sg-11134201-23020-heltd8itqinv0f_tn
23759162153,Set 2 Mặt Nạ Cấp Nước THE FACE SHOP Deeply Mascream Lifting Sheet Mask 40ml,129000,5.0,https://down-vn.img.susercontent.com/file/vn-11134207-7ra0g-m7hfcv3ey77g70_tn
29159638626,"Ashwagandha, Điều chỉnh căng thẳng và tâm trạng, Giảm triệu chứng mất ngủ và trầm cảm, 60 Viên",150500,5.0,https://down-vn.img.susercontent.com/file/vn-11134207-7ras8-m2xpf6jy1uwq5a_tn
10077298370,Đèn ngủ cảm biến Rạng Đông ánh sáng & chuyển động,93000,4.92,https://down-vn.img.susercontent.com/file/47728ad267cee094cd807a79ad5a73b6_tn
7178826249,"Túi đựng laptop , túi chống sốc ultrabook, nhiều ngăn đựng phù hợp size 13.3 - 14 - 15 - 15.6 - 16 Inch",109000,4.95,https://down-vn.img.susercontent.com/file/89c1ba3cc5eeab5f5839e116b4081bea_tn
18991415530,"Túi Đựng Hộp Cơm Giữ Nhiệt BONBOX BLB30 Chống Thấm Nước 3 Lớp, Sức Chứa Lớn",45000,4.95,https://down-vn.img.susercontent.com/file/vn-11134207-7ras8-m62e1xb1iaeu69_tn
26659305354,"Ấm điện đa năng RMK0818 – P bình siêu tốc thủy tinh chịu nhiệt, BH6 tháng",393300,5.0,https://down-vn.img.susercontent.com/file/vn-11134211-7r98o-lzh5tdh7kkst89_tn
23946147292,Thắt lưng nam cao cấp hàng hiệu WilliamPOLO chất liệu da Bò nguyên tấm - POLO23455PZ 01,710000,5.0,https://down-vn.img.susercontent.com/file/vn-11134207-7ras8-m0jsqyblbf1p2b_tn
26051432125,Tai Nghe True Wireless chính hãng Anker Soundcore Liberty 4 NC | Kết nối 2 thiết bị ( 4NC ),1509000,4.89,https://down-vn.img.susercontent.com/file/vn-11134207-7r98o-lvvi7u49zcgp01_tn
19278275357,Giày lười nam MULGATI Loafer đai ngang - A22097,2750000,5.0,https://down-vn.img.susercontent.com/file/vn-11134207-7r98o-lwqyurkvyfo911_tn
23951869605,Kệ gỗ ly cốc ấm trà cây cảnh để bàn kệ gỗ đa năng  gỗ MDF nhập khẩu nhỏ gọn phong cách tối giản hiện đại,35000,4.85,https://down-vn.img.susercontent.com/file/vn-11134211-7r98o-m0b0i8zcwdcf51_tn
23917274311,"Máy bơm hơi tự động 70mai Air Compressor Midrive TP03, dụng cụ hỗ trợ bơm xe ô tô - Minh Tín Shop",559000,4.98,https://down-vn.img.susercontent.com/file/vn-11134201-7r98o-lz91jjrakckh5b_tn
22076178370,"Laptop DELL XPS 9570/ I7-8750H/RAM 16Gb/ SSD M2 NVME 512Gb/ VGA 1050TI 4Gb/Màn 15.6"" full hd",14200000,5.0,https://down-vn.img.susercontent.com/file/vn-11134207-7qukw-lk6kh1nbs5o403_tn
26308188843,Nồi cơm điện Sunhouse SHD8106/SHD8126/SHD8133/SHD8136/SHD8138,679937,3.03,https://down-vn.img.susercontent.com/file/sg-11134201-7rdw8-lz32y5q6rr464e_tn
24563681135,"Set 3 âu trộn Fissler FL01 và Oyatton oyt188 âu trộn salad, trộn bộn làm bánh, đánh trứng, đựng trái cây, inox cao cấp",799000,5.0,https://down-vn.img.susercontent.com/file/vn-11134207-7r98o-lrsfu017iwn836_tn
3341260193,"Bình giữ nhiệt ủ trà inox 304 loại 1 xịn 6L,8L,10L,12L, binh có vòi giữ nhiệt nóng lạnh, đựng nước chuyên dụng pha trà",255000,4.86,https://down-vn.img.susercontent.com/file/vn-11134207-7ras8-m1gpetlnkqxf4d_tn
29705632364,[Hàng mới] Combo 500g bánh cam thảo la hán quả sơn trà không đường dưỡng họng tốt cho sức khỏe,105000,4.65,https://down-vn.img.susercontent.com/file/vn-11134207-7r98o-lxuvnyrjfaopcb_tn
28257708171,Cặp Dầu Gội Xả Olexrs Hair Salon 960ml Cho Tóc Khô Xơ Hư Tổn Tóc Gàu Ngăn Rụng Tóc mượt tóc cao cấp,155000,4.61,https://down-vn.img.susercontent.com/file/vn-11134201-7r98o-lyutajmiw6g120_tn
23948742589,[REFILL] NƯỚC GỘI ĐẦU BỒ KẾT LÊN MEN,320000,5.0,https://down-vn.img.susercontent.com/file/vn-11134207-7r98o-lwmgwem0qqqj4d_tn
18294247253,Vỏ gối ôm Tencel lụa Cao cấp có dây kéo như hình,57000,4.89,https://down-vn.img.susercontent.com/file/vn-11134207-7r98o-lmxdok3ssezj9f_tn
24875912468,"Cốc quà sinh nhật, cốc đựng quà bằng gốm có giá trị cao, hộp quà tặng, cốc uống nước dễ thương cho bạn gái",123760,4.77,https://down-vn.img.susercontent.com/file/sg-11134201-7rd5h-luetfozen7v259_tn
28751134973,Set 2 chảo nhôm trơn cạn 18-24cm SUNHOUSE CT1824C- (Không dùng trên bếp từ) - HAPOS HOF,178600,4.89,https://down-vn.img.susercontent.com/file/sg-11134201-7rdyn-mc0kfqg5sgumb6_tn
18247653642,"Bộ nồi chảo chống dính vân đá Super Chef Tiện Lợi, Bền Bỉ NCQM20-18",1044000,5.0,https://down-vn.img.susercontent.com/file/b02aff04e5d7da1fd056cd2895f28f13_tn
3733340283,"Chiếu điều hoà tencel latex mủ cao su non 3D mẫu hoạt hình ,hàng nhập khẩu loại 1 ( tặng kèm 2 vỏ gối cùng màu)",164000,4.51,https://down-vn.img.susercontent.com/file/vn-11134201-7r98o-lncbwh7bc03ecb_tn
26820491210,SẠC NHANH DEWALT DCB118 LÊN ĐIỆN 220v,799999,5.0,https://down-vn.img.susercontent.com/file/vn-11134207-7ras8-m3or3n3p33xk32_tn
29767541061,Robot Hút Bụi Lau Nhà 3in1 Cao Cấp - Phiên Bản Nâng Cấp Thông Minh Bảo Hành 12 Tháng,150000,4.42,https://down-vn.img.susercontent.com/file/vn-11134201-7ras8-m2khau7jijgm09_tn
8546995612,Phấn phủ Canmake Marshmallow Finish Powder 10g,323000,4.97,https://down-vn.img.susercontent.com/file/8bdf8c9dda0399e6514f2956ac5854d8_tn
16041414324,Sách Tiếng anh cho người mới bắt đầu cô Trang Anh - Bản đặc biệt | Me Book,164000,4.92,https://down-vn.img.susercontent.com/file/vn-11134207-7r98o-lu63lcg45yqne3_tn
23870134309,Gấu Bông Cừu Măng Cụt Nhồi Gòn Mũi Trái Tim Cao Cấp Memon,360000,5.0,https://down-vn.img.susercontent.com/file/vn-11134207-7r98o-lwp6h4dvf0ex04_tn
28705139177,"Tất Nam Đi Giày Lười, Tất Bàn Chân Nam Dạng Lưới Thoáng Mát, Chống Hôi Chân, Gót Silicon Chống Tụt",19000,4.74,https://down-vn.img.susercontent.com/file/vn-11134207-7r98o-lxmcalht8iqjce_tn
19458361577,Yadou Túi Xách Tay Bằng Vải Canvas In Hình Snoopy Dễ Thương Có Ngăn Đựng Hộp Cơm Trưa,85320,4.82,https://down-vn.img.susercontent.com/file/sg-11134201-22100-m1rbsvp407ivd4_tn
18879560004,Khuyên Tai Kẹp Không Cần Bấm Lỗ Chất Liệu Titan Không Gỉ Phụ Kiện Thời Trang Gudi Studio,29000,4.84,https://down-vn.img.susercontent.com/file/vn-11134207-7qukw-lghpk7lrctwq0d_tn
23971661025,Set 6 Ly Vuông Cao Thủy Tinh Thái Lan UG-363 (310ML),93000,4.97,https://down-vn.img.susercontent.com/file/vn-11134207-7r98o-ltg8pszafv2i9a_tn
23977267272,KaBaiQi Giày Bốt dép sandal nữ Mũi Vuông Phong Cách Retro Cá Tính Cho Nữ B94F0RJ 33Z230818,520200,3.5,https://down-vn.img.susercontent.com/file/cn-11134207-7r98o-lkr0eqloljoxa5_tn
28050220016,Đồng Hồ Đeo Tay Điện Tử Đèn LED Mặt Vuông Màu Trơn Họa Tiết Phi Hành Gia Trái Tim Phong Cách Hàn Quốc Cho Học Sinh Nam N,25000,4.31,https://down-vn.img.susercontent.com/file/vn-11134207-7r98o-lyuoaeavdnwt11_tn
6419647593,"Thẻ nhớ 64GB 32GB 16GB 8GB 4GB JVJ tốc độ cao -chuyên dụng CAMERA, Điện thoại,Máy ảnh - Bảo hành 5 năm 1 đổi 1",125000,4.89,https://down-vn.img.susercontent.com/file/2f554755ca058bdc9721d1109cd65c20_tn
23952338554,Giác Trầm Loại lớn Dùng Xông Tài Lộc Cầu Bình An - Trầm Kiến Tự Nhiên Quảng Nam Giá Tận Xưởng,67000,4.66,https://down-vn.img.susercontent.com/file/vn-11134207-7r98o-lksbdggstcxs14_tn
24625313551,Mixiaohe Không Đều Lộn Xộn Cảm Giác Thái Trang Điểm Lông Mi Giả Thái Hướng Dương Cổ Tích Hỗn Hợp Máu cos Lông Mi Thân Trong Suốt,44535,4.85,https://down-vn.img.susercontent.com/file/sg-11134301-7repz-m8cuefxy4aad24_tn
8657813010,Máy Hút Bụi Cầm Tay Perfect PF-SV07 650W Lực Hút 16000pa - Hàng Chính Hãng (Bảo Hành 12 Tháng),449000,4.85,https://down-vn.img.susercontent.com/file/vn-11134207-7qukw-lk0xuuwnklqa9d_tn
23971065075,"Phân Tan Chậm Hạt Bàng Nhật Nurseryase 12-6-6, Phân Hạt Bàng, Chuyên Dùng Cây Bonsai, Cây Cảnh Kiểng",120000,4.88,https://down-vn.img.susercontent.com/file/vn-11134207-7r98o-m04l3y0q84bx5e_tn
18634999571,Đồng Hồ Nữ Chính Hãng Thời Trang GEDI 6621 Mặt Vuông Dây Da 20mm Chống Nước Bảo Hành 12 tháng,265000,4.92,https://down-vn.img.susercontent.com/file/vn-11134207-7qukw-lhk2hz7cltq91e_tn
7165947453,Vớ lười nữ búp bê lụa cao cấp mang giày cao gót giấu vớ có đệm cao su chống trượt chống tuột MOHALI VL006,99900,4.96,https://down-vn.img.susercontent.com/file/vn-11134207-7ras8-mblzc9rfavs08f_tn
19305969083,"[KHÔNG ĐEN GỈ] Dây chuyền titan, vòng cổ nữ hình hạt đậu may mắn Lucky Bean - Mely TT04",59000,4.92,https://down-vn.img.susercontent.com/file/2b390f5c4b5b853a8d5b5082e1fd6890_tn
25829396143,"Nồi Cơm Điện Unie URC815, Công Suất 700W, Dung Tích 1.5L, Lòng Nồi Góm Ceramic, Bảo Hành 12 Tháng.",1660000,4.67,https://down-vn.img.susercontent.com/file/vn-11134207-7r98o-lv2vh9ub1hx504_tn
25170141849,"[Hàng chính hãng] Chảo xào/ đa năng sâu lòng inox iMat Hybrid Blackcube 20cm, Phủ chống dính Ceramic",1595000,5.0,https://down-vn.img.susercontent.com/file/vn-11134207-7r98o-lt51dcbv0n9gc7_tn
20796051008,Nồi nhôm đúc cao cấp Elegant Kaiyo Nhật Bản,615000,4.89,https://down-vn.img.susercontent.com/file/vn-11134207-7r98o-lpgo11lfgle68a_tn
25358612532,"Hộp cơm giữ nhiệt BỈNH Ủ CHANGHOUSE Inox 316, giữ nhiệt đến 12h, quay lò vi sóng, chống tràn",455000,4.84,https://down-vn.img.susercontent.com/file/vn-11134207-7r98o-lv0i610x806x91_tn
15694760367,"Bộ 2 tạ cầm tay 1,5 kg đỏ sẫm DECATHLON DOMYOS mã 8336572",346000,4.81,https://down-vn.img.susercontent.com/file/vn-11134201-7ras8-m5wjjtcoq9q0cd_tn
17599330859,[Shopee - Lắp đặt 0Đ HN HCM] Android TV FHD TCL 43inch - 43S5401A - Smart Tivi - Hàng chính hãng - Bảo hành 2 năm,6590000,4.45,https://down-vn.img.susercontent.com/file/vn-11134207-7ra0g-m7d7yuxg4upid2_tn
29309441256,"Dầu cá 2000mg, giàu EPA+DHA+Omega 3, hỗ trợ sức khỏe não bộ, mắt và tim mạch, giúp giảm viêm, 60viên",431935,4.91,https://down-vn.img.susercontent.com/file/vn-11134207-7r98o-lzin385fxvvl70_tn
25818428210,Balo thời trang nam nữ da đẹp balo đen dập vân size đại để vừa A4 đi học đi làm phong cách Bachhoaonline68 113,105000,4.7,https://down-vn.img.susercontent.com/file/vn-11134207-7r98o-luu54ue0pi4y6e_tn
13325283282,dao thái rau củ hoa quả 198,56000,4.67,https://down-vn.img.susercontent.com/file/vn-11134207-7ras8-m0zc7dv0q3rza8_tn
29302855465,Tmoy 1 / 5 Túi Nước Tiểu Khẩn Cấp Ngoài Trời 700ml Dễ Dàng Mang Đi Piss Túi Du Lịch Mini TCS,12100,4.94,https://down-vn.img.susercontent.com/file/sg-11134201-7rd4d-lwi97ahl7rmd9f_tn
21476463147,"Bút đo nước ion kiềm Daimito YY-400 đo hydrogen, Orp, PH, Nhiệt độ + Tặng kèm pin",900000,5.0,https://down-vn.img.susercontent.com/file/vn-11134207-7r98o-lxe4n2bpy861a2_tn
29957480767,Hộp đựng đồng hồ cao cap,5000,5.0,https://down-vn.img.susercontent.com/file/vn-11134207-7r98o-lyqcdeddbrttdf_tn
23977869316,Bộ Cờ Lê Mở Ống Dầu 5 Chi Tiết Makita B-65545,318000,5.0,https://down-vn.img.susercontent.com/file/vn-11134201-7r98o-ll8yvcvktlmwb1_tn
23968576351,[Chính Hãng] Nhỏ mắt thảo dược dưỡng mắt Happy Eyes Dược Khoa,24999,5.0,https://down-vn.img.susercontent.com/file/vn-11134207-7qukw-lh3gocbhn702aa_tn
23773705684,Máy hút bụi lau nhà Tineco Floor One S5 Combo -  Tự động giặt sấy -Cảm biến thông minh iLOOP - Bản quốc tế - BH 12 tháng,5000000,4.91,https://down-vn.img.susercontent.com/file/vn-11134207-7ra0g-makrji9sdr6g8e_tn
