id,title,final_price,rating,image
25073620632,Jinhf Màn Hình Di Động Để Bàn Giá Đỡ Kim Loại Chân Đế 16 Inch Đa Năng Mở Rộng Màn Hình Hiển Thị Đế Vesa Mount Bên Ngoài Dọc Màn Hình Mở Rộng HOT,353430,5.0,https://down-vn.img.susercontent.com/file/sg-11134201-7rd63-ltz1so41aa6h83_tn
23980471138,Bọc máy giặt cửa ngang vải bạt cao cấp loại dày đẹp,179000,4.89,https://down-vn.img.susercontent.com/file/vn-11134207-7r98o-llqk6swmyb4va4_tn
13958861256,Túi xách nữ đeo chéo đeo vai thời trang hàn quốc da mềm cao cấp babumap_ TDC116,31500,4.85,https://down-vn.img.susercontent.com/file/vn-11134207-7qukw-lk7l51qnvpj645_tn
29051968075,"Đồng Hồ Nam Hublots Mặt Lộ Lịch NB Lắp Ráp, Size 38/42 Chống Nước 5ATM , Bh 5 Năm",2566000,5.0,https://down-vn.img.susercontent.com/file/vn-11134207-7r98o-lz7vkwd642tp81_tn
23951205405,Bốt YUNGUANG ống cao vừa họa tiết thêu thời trang cá tính cho nữ,397000,5.0,https://down-vn.img.susercontent.com/file/cn-11134207-7qukw-lkeznoz6dfhybe_tn
29856658983,"Khăn quàng choàng cổ lụa cao cấp cho nữ iLita khăn lụa văn phòng công sở, đi biển đẹp phối màu xanh lá vàng",74400,4.82,https://down-vn.img.susercontent.com/file/vn-11134207-7r98o-lyd6kplzmfyl89_tn
22582921968,"Nồi cơm Cuckoo 1.2L nắp gài, lòng nồi chống dính cao cấp, thiết kế nhỏ gọn",325000,4.81,https://down-vn.img.susercontent.com/file/vn-11134207-7r98o-lmonvduobf8f3c_tn
20892399702,Mắt kính Titanium Despoints Luxury Shadow Chất liệu Titan cao cấp nhất DP04,700000,5.0,https://down-vn.img.susercontent.com/file/vn-11134207-7r98o-lyag2oko8kel0a_tn
21400769731,bộ lõi 123 AQUA TL,40000,4.88,https://down-vn.img.susercontent.com/file/b7e20d00bf6273d36014037d4eb078be_tn
11411855270,[Paperlike Nam Châm] Miếng dán AstroMazing Paperfilm Paper Like dành cho iPad Air 4 5 Pro 11 Gen 9,219000,4.9,https://down-vn.img.susercontent.com/file/vn-11134207-7r98o-lm6whvrw0k4f1d_tn
8659782644,Kem Dưỡng Cấp Ẩm & Làm Sáng Da Reihaku Hatomugi Moisturizing & Conditioning Milky Cream 300g,105000,4.93,https://down-vn.img.susercontent.com/file/vn-11134207-7r98o-lvbf6hu4t37x05_tn
27757217383,Thùng 32 gói Phú Đạt Gấu Béo không mùi 120 tờ date mới nhất,290000,4.92,https://down-vn.img.susercontent.com/file/vn-11134207-7r98o-lyn705b2elal5b_tn
9577494176,"Nước Lau Sàn Sunlight Tinh Dầu Thảo Mộc Sạch Bóng | Túi 3,6 KG | Hoa Hạ - Bạc Hà | Lily - Bạch Trà | Hoa Lavender",80000,4.92,https://down-vn.img.susercontent.com/file/vn-11134207-7ra0g-m7amxs0588ose4_tn
23940601014,"Cầu chì micro dùng cho xe ô tô, xe máy",1000,4.73,https://down-vn.img.susercontent.com/file/vn-11134207-7qukw-lh8hottwn5ma45_tn
29955483679,[Kam] 1 Hộp đựng thẻ truy cập bằng da Hộp đựng thẻ móc khóa Khóa cửa Thẻ truy cập Hộp đựng thẻ ID Móc khóa Túi đựng thẻ truy cập tốt,15660,4.78,https://down-vn.img.susercontent.com/file/sg-11134201-7rdwy-lxshq5egpi8v95_tn
24888559426,Bộ 4 chân chống rung PLSHARK máy giặt có thể tăng giảm chiều cao [ HÀNG TỐT ],29000,4.62,https://down-vn.img.susercontent.com/file/vn-11134207-7ras8-m2xm92djvfu890_tn
18980196285,"Tai nghe Bluetooth không dây HAYLOU GT6 5.2 Ghép Nối Tự Động, Tai Nghe Không Dây Độ Trễ Thấp Âm Thanh Mono Và AAC Stero",259000,4.57,https://down-vn.img.susercontent.com/file/vn-11134207-7qukw-lh7krtt0cg1e2a_tn
25122507287,"Áo điều hòa 3 quạt, 2 quạt loại A+ HUSU SIÊU MẠNH 12V không chổi than - Pin 50.000mAh làm mát 8-16h",740000,4.74,https://down-vn.img.susercontent.com/file/vn-11134207-7ra0g-m8pn0is2yop32c_tn
15219076271,"[NSX] Tinh chất làm sáng da, cải thiện thâm nám PHARMAFORM Skin Brightener Serum 20ml",390000,4.94,https://down-vn.img.susercontent.com/file/vn-11134207-7ras8-m0mwj4ssu57xea_tn
23976107671,Dành cho iphone AirPods Pro AirPods 1 / 2 / 3 / 4 Vỏ tai nghe không dây vuông màu đen qua vuông,49787,4.82,https://down-vn.img.susercontent.com/file/cn-11134207-7qukw-lk5g0rs6vrhwc6_tn
12629062800,Cặp da nam công sở TRITA TCA17,269000,4.94,https://down-vn.img.susercontent.com/file/sg-11134201-7ra0h-m5cktvy5p4yzb6_tn
25235189827,COMBO 20 Miếng Mặt Nạ Vải Sinh học Tencel Mask 23gx20 - Không hộp,490000,4.96,https://down-vn.img.susercontent.com/file/vn-11134207-7ra0g-m6txd7i2u8go52_tn
23869681877,"Cây nước nóng lạnh bàn trà cafe bình âm FujiE nhập khẩu, máy nước nóng lạnh điều khiển từ xa cài đặt nhiệt độ",2371000,4.61,https://down-vn.img.susercontent.com/file/vn-11134207-7qukw-lhn7x2znyrb5f7_tn
29658140944,"Nước Nhỏ Mắt Nhân Tạo Santen Soft Santear Nhật Bản - 2 Màu Xanh và Đỏ ( Giảm mỏi mắt , khô mắt )",101000,4.85,https://down-vn.img.susercontent.com/file/vn-11134207-7r98o-lz1oej3bvkwx67_tn
25766443151,"Máy xay sinh tố không dây Lazychef, máy xay cầm tay đa năng 3i﻿n1 450ml, 6 lưỡi dao, bảo hành chính hãng",470000,4.95,https://down-vn.img.susercontent.com/file/vn-11134207-7r98o-lser484xfpokba_tn
18883978947,"Túi kẹp nách nam da bò , ví cầm tay nam , clutch nam cao cấp WILLIAMPOLO",990000,5.0,https://down-vn.img.susercontent.com/file/vn-11134207-7r98o-lxrzl6gg9xi3ff_tn
22390269043,"Dụng cụ mài dao, kéo cao cấp kiwi",54000,4.69,https://down-vn.img.susercontent.com/file/vn-11134207-7r98o-ly6wsgvqrt7lca_tn
20817133395,"Quần đùi mặc trong váy (mẫu chống lộ phần tam giác nhạy cảm) - quần váy nữ, mặc trong váy- hickies lacing system",36000,4.88,https://down-vn.img.susercontent.com/file/vn-11134207-7qukw-lf1c635vlxmye8_tn
23972352624,"[Hình ủi, ép nhiệt] Hình Gấu Care Bears CB13 bằng bàn là, bàn ủi",11000,5.0,https://down-vn.img.susercontent.com/file/vn-11134207-7qukw-limx67t2edw288_tn
25529878447,Bánh thuyền mix hạt dinh dưỡng Hoàng Kiều healthyfood Bánh ăn kiêng hỗ trợ giảm cân 500gram,149500,5.0,https://down-vn.img.susercontent.com/file/vn-11134207-7ras8-m2dnd39rf73o7a_tn
16542165757,Vỉ 50 Viên Uống Nhuận Tràng Detox Kenton Diet Kokando - Nhật Bản,34000,4.93,https://down-vn.img.susercontent.com/file/vn-11134207-7r98o-ltnrf9fkhkayc2_tn
23544179317,"Máy giặt cầm tay cao cấp Jetzt dành cho ghế sofa, nệm thảm",2088000,4.69,https://down-vn.img.susercontent.com/file/vn-11134207-7ra0g-m7alf0t7tw58e9_tn
16694879722,5packs 20pcs 1st mesh base roth 022 single no-convertible buccal tube bracket,79519,5.0,https://down-vn.img.susercontent.com/file/cn-11134207-7qukw-lhog1ce9y8yr52_tn
21961191893,"Kính Cường Lực iphone Tự Dán,Tự Hút Bụi Chống Nhìn Trộm dành cho ip x/xs/xsmax/11/11promax/12/13/14/15/15promax",25000,4.83,https://down-vn.img.susercontent.com/file/vn-11134207-7r98o-llmz3lb5caj3d7_tn
22753797967,Gel thơm làm sạch khử mùi vệ sinh Diệt khuẩn khử trùng bồn cầu hình bông hoa gel khử mùi bồn cầu khử mùi nhà vệ sinh,32000,4.76,https://down-vn.img.susercontent.com/file/vn-11134207-7ras8-m63kplctyhtk12_tn
23956326838,"Hộp đựng cơm giữ nhiệt văn phòng 2 tầng, chất liệu Inox 304 và lúa mạch cao cấp",165000,4.83,https://down-vn.img.susercontent.com/file/vn-11134207-7r98o-lm7qf8e3rye7c9_tn
22779988809,"Th Cá Chai d*** mạnh cá rô , tất cả loại cá tạp trong ao chai 100ml",85000,4.82,https://down-vn.img.susercontent.com/file/vn-11134207-7r98o-llk7boaxew2082_tn
10012286759,Bộ ga gối lụa tencel mềm mát loáng mịn cao cấp 4 món không kèm chăn,396000,4.85,https://down-vn.img.susercontent.com/file/vn-11134207-7ras8-m0lkgv6s7wcv5f_tn
21493293574,"Bộ Nồi Silit Diamant 7 Món Nội Địa Đức, Bộ Xoong Nồi Đức Chất Liệu Inox Không Gỉ Chất Lượng Châu Âu GermanySnT HCM 70015",4659000,5.0,https://down-vn.img.susercontent.com/file/vn-11134207-7r98o-llyprcnkfqan53_tn
23472226400,"Máy chưng nước cất dùng trong nha khoa,y tế",1570000,4.92,https://down-vn.img.susercontent.com/file/vn-11134201-7r98o-lnb8u56dbhiya3_tn
6013742093,Máy Ảnh Ống Kính Fujifilm XF 18-55mm f / 2.8-4 R LM OIS (chính hãng Fujifilm Việt Nam),9300000,5.0,https://down-vn.img.susercontent.com/file/80bab0ab4dd1e319315e0d2c30a03d8a_tn
28811767623,"Bếp điện mini cho sinh viên, Bếp đơn đa năng không kén nồi 1000W, hơ lá trầu cho bé 5 mức nhiệt",489000,4.33,https://down-vn.img.susercontent.com/file/vn-11134207-7r98o-m0ctxakcjch994_tn
7917680263,Erosska - Dép mule cao gót quai trong mũi vuông gót trong màu nude cao 9cm - EM040,179000,4.87,https://down-vn.img.susercontent.com/file/56f76fd51780237f2a9308773958954d_tn
27430576655,Quần short bò ngố nam PB xanh bụi rách xước đùi phối thêu logo in vân monogram túi và ống xắn QS322P,289000,4.8,https://down-vn.img.susercontent.com/file/vn-11134207-7ra0g-m7orlryt4bzlee_tn
26221311483,"Khay Đựng Mứt Tết 6 Hũ Ngăn Thủy Tinh Đựng Bánh Kẹo, Mứt Tết, Hạt Dưa Sang Trọng, Hũ Đựng Kẹo Ngày Tết",250000,4.61,https://down-vn.img.susercontent.com/file/vn-11134207-7ras8-m41knsav9brj24_tn
25134376144,"Máy điều chỉnh nhiệt độ thông minh Tín Phát, mã TP04, chạy theo nhiệt độ, luân phiên theo thời gian",377000,4.88,https://down-vn.img.susercontent.com/file/vn-11134207-7r98o-lyklb4e4vn3502_tn
28156867758,[Choice] Giỏ Đựng Đồ Việt Nhật TR1-20456-777 Bằng Nhựa Cao Cấp Kiểu Nhật Bản,46200,4.64,https://down-vn.img.susercontent.com/file/vn-11134207-7ra0g-m6wa69n2nv6p14_tn
9632533395,[Tặng 2 Vỏ Gối] Chiếu Điều Hòa Mủ Cao Su Non 3D Tencel Latex Mát Mềm Mịn Nhập Khẩu,500000,4.93,https://down-vn.img.susercontent.com/file/126475e748082712ee9c8c523d64bf36_tn
24455042170,"Gối, vỏ gối, ruột gối ôm vải Tencel 38x100 có khóa kéo NỆM KIM CƯƠNG chính hãng",119000,4.59,https://down-vn.img.susercontent.com/file/vn-11134207-7r98o-m0azqrccc25p2b_tn
29605237995,"Máy Hút Bụi Cầm Tay Không Dây Đa Năng Điều Chỉnh Độ Dài, Lực Hút 8500PA Siêu Mạnh Hút Gầm Giường, Sofa, Ô Tô",199000,5.0,https://down-vn.img.susercontent.com/file/vn-11134207-7ras8-m2ifyqle9ar674_tn
23936904496,"COMBO SUPER NACH X5 2IN1 Serum nach, Toner nach, Xịt miệng Kiss Love NLS",220000,4.9,https://down-vn.img.susercontent.com/file/vn-11134207-7r98o-lqn55ttle9tj49_tn
23951062921,"Mực in date DY8 , HP241 LC6 30mm x 122m - Mực in nhiệt Ruy Băng, In Hạn Sử Dụng",23000,4.95,https://down-vn.img.susercontent.com/file/vn-11134207-7ras8-m1mx94ukf1kv34_tn
12534889291,(Giá Hủy Diệt) Thẻ nhớ microSDXC Samsung Evo Plus U3 A2 64GB / 128GB / 256GB - Hàng Chính Hãng,850000,4.95,https://down-vn.img.susercontent.com/file/vn-11134207-7qukw-lhhejjb52myp1c_tn
21279723049,Dịch truyền kích thích phục hồi cây : dịch nâu,119000,4.72,https://down-vn.img.susercontent.com/file/vn-11134207-7qukw-lgp7ci061jw31f_tn
23980247521,"Áo thun nam, áo phông nam tay ngắn cổ tròn chất cotton dày dặn thoáng mát ATN082 - Áo thun An Cường",69900,4.8,https://down-vn.img.susercontent.com/file/vn-11134207-7r98o-llnejr8vz1hr37_tn
6490137147,"Chuối Sấy Mè Gừng Giòn Tan 1Kg [CÓ BÁN SỈ] , [Loại Đặc Biệt] Hàng ngon nhà làm",50000,4.76,https://down-vn.img.susercontent.com/file/sg-11134201-22100-dmn1etnpusiv51_tn
23051759261,Chảo Bầu Nhôm Anod SUNHOUSE SWP20B(20cm)-SWP36B(36cm) có Size 20-36CM Không Dùng Với Bếp Từ-KIMBAO,97125,4.89,https://down-vn.img.susercontent.com/file/vn-11134207-7r98o-lqswgawxwhmf53_tn
29056070483,Dây thun ràng tăng chỉnh kích thước 2M-3M-4M,99000,4.8,https://down-vn.img.susercontent.com/file/vn-11134207-7r98o-lz5xdu9nne75e0_tn
19295808043,"Nồi niêu , tộ kho bằng gang Thái Lan đủ Size",235000,4.85,https://down-vn.img.susercontent.com/file/vn-11134207-7ra0g-m7xtoepgpd9q6c_tn
26771097032,"Viên rửa bát hữu cơ Frosch All in 1 hương chanh Viên rửa chén hữu cơ làm sạch hiệu quả, an toàn",550000,4.75,https://down-vn.img.susercontent.com/file/vn-11134207-7ras8-mcvuljg6zx33bb_tn
24623202751,"Cối thủy tinh, cối inox máy xay thịt 2L",45000,4.78,https://down-vn.img.susercontent.com/file/vn-11134207-7r98o-m06suqaajxqn91_tn
23955173361,Cặp Công Sở Lata (Thời trang nam basic đựng laptop 15 inch - Cặp da CA31),449000,4.75,https://down-vn.img.susercontent.com/file/sg-11134201-7rauc-ma3g5hwuaa8sb2_tn
29961050334,K & F Concept 49-82mm Bộ lọc ống kính hiệu ứng Streak vàng (2mm) Bộ lọc hiệu ứng ánh sáng thủy tinh quang học Anamorphic cho ống kính máy ảnh Nano-Xcel Series 49 / 52 / 55 / 58 / 62 / 67 / 72 / 77 / 82mm,608300,5.0,https://down-vn.img.susercontent.com/file/cn-11134207-7r98o-m02uyn58yw9379_tn
27070669645,"Máy siết bulong AKUZA 1250N.m. Không Chổi Than, tính năng giảm trấn - Có Búa- Lõi Đồng,2 pin 15 cell",1965600,4.92,https://down-vn.img.susercontent.com/file/vn-11134207-7ras8-m4l8y981zfm7d3_tn
25428904961,"Nồi Điện Đa Năng, Tay Cầm Gấp Gọn, Nồi Cơm Điện Mini 1 Người, Nồi Lẩu Điện Đa Năng",139000,4.75,https://down-vn.img.susercontent.com/file/vn-11134207-7ra0g-m8olj996fps4bc_tn
2378637419,"Đầu vòi tăng áp,Đầu vòi tăng áp rửa bát -3 chế độ phun cực mạnh- xoay được (ren vặn 22mm)",19502,4.89,https://down-vn.img.susercontent.com/file/7e1f8f49393cedafba4112564bf9c528_tn
29203236481,"Chảo Thép Tôi Chống Dính Dùng Trong Nhà Hàng Joful Home Có Cán Cách Nhiệt An Toàn Sử Dụng, Chống Mài Mòn Chống Dính Tốt",167310,4.88,https://down-vn.img.susercontent.com/file/sg-11134201-7rd3z-lwpkwiasyxl0a0_tn
28673771950,Máy Xay Thịt Đa Năng Hichiko HC9912– Trợ Thủ Đắc Lực Cho Căn Bếp Hiện Đại,719000,5.0,https://down-vn.img.susercontent.com/file/vn-11134207-7ras8-m542oinjmr7a11_tn
23967149795,xích đu dẻo chịu lực,260000,5.0,https://down-vn.img.susercontent.com/file/vn-11134201-7qukw-lgggt71ya8veb6_tn
23486345076,Tay cầm chơi game DAREU H105 / H106 Pro (TRIPLE MODE: USB cable+2.4G+Bluetooth),675000,4.86,https://down-vn.img.susercontent.com/file/vn-11134207-7r98o-lo2fslpuun3u29_tn
12438360285,Đũa hợp kim màu ngũ hành (bộ 5 đôi) FASOLA FSLPS-717,110000,4.98,https://down-vn.img.susercontent.com/file/vn-11134207-7ra0g-m9it201h1nqm90_tn
26685394737,GAIFEEL LITE 20 gói 84 khăn ướt không mùi khăn ướt trẻ em không cồn không có parabens khăn ướt,295000,4.33,https://down-vn.img.susercontent.com/file/cn-11134207-7ras8-mc61dezrq06169_tn
19086181232,"Nồi chiên không dầu SOKANY 16L công suất cao 2500W SK-8032 đa chức năng, màn hình cảm ứng, tiết kiệm điện, dễ sử dụng",2009000,5.0,https://down-vn.img.susercontent.com/file/vn-11134207-7r98o-lpuc7eg7auoi71_tn
28402867211,Thùng 32 gói khăn ướt TINA BABY siêu to sử dụng cho em bé 120 gram/ gói,286350,4.68,https://down-vn.img.susercontent.com/file/vn-11134207-7r98o-lybttjfwxhghd6_tn
25107171363,🔥Hot🔥 Giày Thể Thao Nữ phong cách Hàn Quốc Giày bata dày của phụ nữ,48000,4.72,https://down-vn.img.susercontent.com/file/sg-11134201-7rbn9-lq8pxsgodkp3e8_tn
7831274667,"Dép Sandan Nam Nữ, Sandal Học Sinh Quai Ngang(Đế cao 2,5cm)",92000,4.79,https://down-vn.img.susercontent.com/file/b25adce0f770c8d0c29a504b3debf0f1_tn
23938475783,Siro Ho Thảo Dược Hữu Cơ Banyan 177ml,669000,5.0,https://down-vn.img.susercontent.com/file/vn-11134207-7r98o-lu91o5dtctun61_tn
14311629562,Đồng Hồ Nam Chính Hãng POEDAGAR Đồng Hồ Đeo Tay Dây Thép Cao Cấp Kháng Nước,289000,4.85,https://down-vn.img.susercontent.com/file/vn-11134207-7r98o-lurq2xpu7swica_tn
23946360975,Thảm xốp chải sàn gấp gọn xốp chải sàn 2 mặt chống trơn 1m8 - 2m,99000,4.88,https://down-vn.img.susercontent.com/file/vn-11134207-7qukw-lif8yy5zqxn6ac_tn
27250502832,Xe Máy Honda Wave RSX - Phiên Bản Tiêu Chuẩn 2024,23881171,5.0,https://down-vn.img.susercontent.com/file/vn-11134207-7ra0g-m67zph9e8n437d_tn
22976860568,"Tinh dầu Tràm Huế Hồng Tâm 100ml Giải cảm, giữ ấm đường hô hấp, làm sạch không khí...",190000,4.99,https://down-vn.img.susercontent.com/file/vn-11134207-7ras8-m0ck6js4duy584_tn
10249099703,Miếng dán PPF bảo vệ màn hình chống trầy thích hợp cho iPhone 16 Pro Max 15 14 13 12 Mini 11 Pro XR X XS Max 7 8 6 6s Plus SE 2020 Chống Nhìn Trộm Chống Vân Tay bảo vệ mắt Clear Matte Anti Blue Green Light Bảo vệ màn hình,17600,4.65,https://down-vn.img.susercontent.com/file/cn-11134207-7qukw-lj28r2178k1m16_tn
23946316949,"Muôi / Vá Múc Canh Inox 304 Mạ Vàng, Bạc Bóng Loáng Dày Dặn Bền Đẹp 20.5cm",8800,4.66,https://down-vn.img.susercontent.com/file/vn-11134207-7qukw-lie05qeol6fm42_tn
22286949539,Thắt lưng nam Dabaraac da cao cấp khóa kim loại tự động không gỉ - Cam kết bảo hành 12 tháng TL71,59000,4.87,https://down-vn.img.susercontent.com/file/vn-11134207-7ras8-m47kcg4e3pc796_tn
9401755733,Công tắc điều khiển từ xa + Honest HT9220KG 1KM + công xuất 30A + nguồn 220V và 380V,165000,5.0,https://down-vn.img.susercontent.com/file/092f2b9bd96702ca7620f1bc9422fd3e_tn
25476914377,"Bút Nhũ Mắt & Gọt Chì Too Cool For School Artclass Frottage Pencil, Artist Pencil Sharpener",195000,4.93,https://down-vn.img.susercontent.com/file/vn-11134207-7r98o-luljptvaf60589_tn
23939355153,BJPKPK 50 / 100 / 200 / 300 Bọc nhựa dùng một lần kèm túi gấu dễ thương,12834,4.82,https://down-vn.img.susercontent.com/file/cn-11134207-7qukw-lfly3f5oe2m02d_tn
14854381040,"SERUM Trắng Da, Ngừa Mụn Senana 15ml Trẻ Hóa Da, Kiểm Soát Dầu, Dưỡng Ẩm A233",16000,4.7,https://down-vn.img.susercontent.com/file/vn-11134207-7qukw-ljybnc9gdlhe3e_tn
25930174144,Genshin Impact primogems cosplay Costume game Chạm Bộ Đồ Hóa Trang Búp Bê Anime Hai Chiều Cho Nam Và Nữ,149100,4.0,https://down-vn.img.susercontent.com/file/vn-11134207-7r98o-lv890x4o385588_tn
23176203052,"Chảo đá nướng điện chống dính, chảo nướng thịt BBQ phủ đá cao cấp, chảo điện nướng đa năng không cần dầu",690000,5.0,https://down-vn.img.susercontent.com/file/vn-11134207-7r98o-lymjajblz7f116_tn
617294982,Nồi cơm điện 1.2L SUNHOUSE MAMA SHD8265G / SHD8265B lòng nồi dày,1169000,4.97,https://down-vn.img.susercontent.com/file/vn-11134201-7ra0g-ma3y8puaxoci38_tn
28057959777,Áo vệ sinh sọc cityboy Nhật Bản nam thủy triều ins áo phông dài tay nặng quá size thủy triều mùa thu trên quần áo,160920,4.8,https://down-vn.img.susercontent.com/file/sg-11134201-7rdyu-lyyq4revkv5je7_tn
23942444609,"Tăm bông ngoáy tai, Bông tăm bông tẩy trang dùng một lần xoắn ốc 2 đầu tiện lợi 88388 THẾ GIỚI TIỆN ÍCH",14999,4.77,https://down-vn.img.susercontent.com/file/vn-11134207-7qukw-lgt5oo74dcfm59_tn
23759212780,"Bộ sản phẩm chăm sóc tóc và Sữa tắm nước hoa, trắng da toàn thân Weilaiya 450ml",1419000,4.97,https://down-vn.img.susercontent.com/file/vn-11134207-7ras8-m2c0jmed58s286_tn
11656558454,Nồi cơm điện mi ni đun trên ô tô 12v-24v,299000,4.62,https://down-vn.img.susercontent.com/file/7cef5ad805d05202600c2eb84a343b81_tn
12399499080,"Nồi Điện Mini Đa Chức Năng Kèm Lồng Hấp, Nồi Bí Ngô 2 Tầng Nấu Cơm, Chiên, Xào, Rán Tiện Lợi X383",165000,4.77,https://down-vn.img.susercontent.com/file/vn-11134207-7qukw-lhojb2p3frup2c_tn
23579217127,Cốc Thả Bồn Làm Sạch Bồn Cầu Dạng Sáp Tan Chậm 2400 Lượt Xả Tương Đương 3 Tháng Sử Dụng Lọ Thả Bồn Cầu KoMo,33500,4.82,https://down-vn.img.susercontent.com/file/vn-11134207-7r98o-lvot1qarnipl9a_tn
24436673420,(HCM)CHÍNH HÃNG BẢO HÀNH 10 NĂM - MÁY ÉP CHẬM HUROM H410 MÀU XÁM,7560000,5.0,https://down-vn.img.susercontent.com/file/vn-11134207-7ras8-m0wfxfax3qi523_tn
23969791751,"【Khuyến mãi lớn】Giày cao gót 5 phân mũi nhọn đế vuông công sở nữ Đẹp và sành điệu, tín đồ thời trang",225742,4.81,https://down-vn.img.susercontent.com/file/cn-11134207-7r98o-lwjiqafe6a03b9_tn
23880719145,Viên Sữa Ong Chúa Tinh Nghệ Mật Ong 330Gram - Tiệm Phố Núi,155800,4.9,https://down-vn.img.susercontent.com/file/vn-11134201-7r98o-lluif5x9l9zz8b_tn
23967993624,Đèn Đội Đầu 1 Bóng Kèm Cục Sạc 30W Đèn Pin Đeo Trán 1 Bóng Lớn Soi Ếch,41900,4.77,https://down-vn.img.susercontent.com/file/vn-11134201-7qukw-lgubrca30ann05_tn
23981303843,"REVIVE Vitamin D3 5000 IU 60 viên : Bảo vệ xương khớp, tim mạch by CBUM",330000,4.95,https://down-vn.img.susercontent.com/file/vn-11134211-7r98o-lm17ztanuaxrd7_tn
23982219019,Căm DID 9G (lỗ lớn) xe Yamaha Sirius dĩa trước D046Z,102000,3.67,https://down-vn.img.susercontent.com/file/vn-11134207-7r98o-lmflpd8790pr09_tn
23045595780,BOOM cặp đi học Đi Học Ba Lô Thời Trang 2023 new L95S02R,211680,4.61,https://down-vn.img.susercontent.com/file/cn-11134207-7qukw-ligrya5zge4a97_tn
25224312500,Nồi cơm điện tử Beemi - Nồi cơm điện đa chức năng dung tích 2L phù hợp cho 4-6 người 8 chế độ nấu có hẹn giờ và giữ ấm,805000,4.5,https://down-vn.img.susercontent.com/file/vn-11134207-7r98o-lve4z1tbyowdb9_tn
23651865171,Bộ Áo Liền Quần Hóa Trang Siêu Anh Hùng samurai sentai shinkenger Ranger Cho Người Lớn Và Trẻ Em,216000,4.92,https://down-vn.img.susercontent.com/file/sg-11134201-22110-kays7x579xjvc6_tn
27403177070,"Áo Thun Oversize Con Muổi Hài Hước, Form Rộng Cotton Co Giản 2 Chiều",145000,5.0,https://down-vn.img.susercontent.com/file/vn-11134207-7r98o-lwuqort48r1568_tn
24908459171,Túi Rác Tự Phân Hủy - Bao Rác Đen Kích Thước Lớn 55*65 cm 1 cuộn,10900,4.6,https://down-vn.img.susercontent.com/file/ac1cb090f33a4d64af42e59f3da757d9_tn
29013591003,[chính hãng] NỒI CƠM ĐIỆN 1.8L SUNHOUSE SHD8663G - Hàng chính hãng bảo hành 12 tháng,958080,5.0,https://down-vn.img.susercontent.com/file/vn-11134207-7ras8-m15e61vf1lyy88_tn
13816695989,Chảo chống dính inox liền khối Elmich Trimax CZ EL-3835 size 20cm chảo xào sâu lòng,650000,4.87,https://down-vn.img.susercontent.com/file/vn-11134207-7ra0g-m7swzmz0lpl253_tn
21893042348,"Màn hình VIEWSONIC VX2758-2K-PRO5 27"" 2K iPS Super Clear 185Hz 1ms HDR10 Freesynce G-synce (bh 12 tháng)",3700000,4.97,https://down-vn.img.susercontent.com/file/vn-11134207-7r98o-ly4ulo7up5e829_tn
8179437026,"Phụ kiện bàn thờ thần tài mini,nhang,cafe,chum,cóc,lư hương,bình bông,mèo,heo gà vịt dưa hấu (xưởng sx chính)",10000,4.89,https://down-vn.img.susercontent.com/file/vn-11134207-7r98o-lvan2yfxwcbo12_tn
7815236948,"Lõi Nhiệt 936 60w (loại 2 dây 220v ±400Ω) , sensor tq936 60w , sensor 936 , ruột mỏ hàn thiếc.",35000,4.93,https://down-vn.img.susercontent.com/file/e30d59aec40f8fa0a5f88f005eb42eee_tn
3940299754,"Thanh đồng đỏ 3mmx 15mm dài 15cm, 20cm.",54000,4.99,https://down-vn.img.susercontent.com/file/0d83d8625b2769e349854ce6244755a0_tn
13886098431,"[Max 305] Size lớn 95kg, Quần Short Jean Cotton Nam Vải KHÔNG CO DÃN ===========================>>>",119990,4.7,https://down-vn.img.susercontent.com/file/78611d8fce4c7671c4a7c967c018e652_tn
29758239242,lisen Giá đỡ điện thoại từ tính 360°Giá đỡ điện thoại xoay Giá đỡ điện thoại ô tô,309100,4.88,https://down-vn.img.susercontent.com/file/cn-11134207-7r98o-lz4huq7k3yxuc8_tn
15098120935,"Tinh dầu thơm nữ CODEDECO 25.05 10ml dạng lăn - Dịu mát, Tươi mới, Ngọt ngào",222000,4.81,https://down-vn.img.susercontent.com/file/vn-11134207-7ra0g-m7fxdtcxx0s31c_tn
28106999040,Nồi cơm điện tử Joyoung JRC-7130 | Dung tích 1.8L | Công suất 850W,1490000,4.83,https://down-vn.img.susercontent.com/file/vn-11134207-7ras8-mcj1k1pg40q5a9_tn
11789957425,Quần short đũi nam siêu mát kiểu dáng trẻ trung,77000,4.69,https://down-vn.img.susercontent.com/file/vn-11134207-7qukw-ljdn1vd0ztg26a_tn
26402683185,Tiếp điểm nồi cơm kèm thanh sắt,8000,5.0,https://down-vn.img.susercontent.com/file/vn-11134207-7r98o-lwgn26pxek0rf8_tn
29956434698,Vòng Cổ - Dây chuyền nam titan cao cấp sang trọng inox thép không gỉ hỏa tiển trơn wakaha vn cỡ 4mm PTDCNA14,20900,5.0,https://down-vn.img.susercontent.com/file/vn-11134201-7r98o-ly8t8w2kzbtt09_tn
7772013023,Giày tập đi đế mềm hoạ tiết kẻ sọc cho bé,29000,4.78,https://down-vn.img.susercontent.com/file/148213d909c805e48d613e68470a9fd2_tn
7358410693,"Máy Hút Bụi Cầm Tay có dây Deerma DX900, DX700S, DX700, DX810 - BH CHÍNH HÃNG 06 Tháng",950000,4.94,https://down-vn.img.susercontent.com/file/sg-11134201-23010-i4q4mu60g1lv59_tn
25203067136,"Đèn LED Cảm Biến Chuyển Động Gắn Tường Sạc USB, Đèn Cảm Biến Gắn Cầu Thang, Phòng Ngủ, Phòng Bếp",19000,4.68,https://down-vn.img.susercontent.com/file/vn-11134207-7r98o-lp23p4bie8gr00_tn
4709773137,"DEAL SỊN GIÁ TỐT ♥️ 1 BỊCH ĐẠI STEPBABY  ♥️  Tã/Bỉm Quần Step baby ♥️Đủ size♥️ Babycute, bỉm khỉ",575000,4.94,https://down-vn.img.susercontent.com/file/vn-11134207-7ras8-m45w4240ejm7f6_tn
25476320244,"Tất đá bóng chống trơn MINUTE dệt kim dày dặn không gây mùi, tất đá bóng 6 màu có đế cao su non chống trượt hiệu quả",26800,4.84,https://down-vn.img.susercontent.com/file/vn-11134207-7r98o-luhlq3mlcnpu71_tn
