id,title,final_price,rating,image
22539952524,Sỉ 100 Dao gọt trái cây Nhật nhiều màu giá rẻ,358000,4.73,https://down-vn.img.susercontent.com/file/vn-11134207-7qukw-lfrz373oumi2c2_tn
19162306143,"Máy làm sữa hạt đa năng chính hãng Ceool - Máy làm sữa đậu nành, máy đa năng làm sữa đậu nành,nấu cháo chậm chống trào",974000,4.95,https://down-vn.img.susercontent.com/file/vn-11134207-7ras8-manug7t3wi54d0_tn
20830363716,"Rổ Lọc Rác, Thức Ăn Thừa - Giỏ Đựng Dụng Cụ Bồn Rửa Bát - Ngăn Tắc Cống",75000,4.81,https://down-vn.img.susercontent.com/file/vn-11134207-7r98o-lpdwdtzlli6z60_tn
23945370118,【Giao hàng 24 giờ⚡️】Cờ Lê Cầm Tay Tiết Kiệm Sức Lao Động Chuyên Dụng Sửa Chữa Bánh Xe Hơi,40000,4.78,https://down-vn.img.susercontent.com/file/vn-11134207-7qukw-lhyku4ey42wx09_tn
23951984516,"Cọ Rửa Cốc Chén Bình Sữa Silicon Cán Dài, Cọ Silicone Cán Dài Xoay 360 Độ Dùng Để Rửa Ly Chén Dĩa Tiện Lợi",3900,4.83,https://down-vn.img.susercontent.com/file/vn-11134207-7r98o-lknly8a4qtii52_tn
7908414929,1kg túi nilon PE gói hàng Đỏ đẹp (bóng dai),35400,4.86,https://down-vn.img.susercontent.com/file/9ce71609c2a003c5ae59c68d926dfbac_tn
23974096701,Ống hút xăng dầu chất lỏng bóp tay dài 1m tiện lợi,24900,4.9,https://down-vn.img.susercontent.com/file/vn-11134207-7qukw-ljcn3m1e4u6q47_tn
23981301191,[Trẻ Em Chuyên Nghiệp] Giày Đánh Cầu Lông / tennis Chính Hãng Thoáng Khí Cho Bé Trai Và Bé Gái,412263,4.33,https://down-vn.img.susercontent.com/file/vn-11134201-7r98o-lm19ghpmo0dbc9_tn
24834748936,Sách - Biệt thự buồn (Patrick Modiano) (Nhã Nam),100300,4.63,https://down-vn.img.susercontent.com/file/vn-11134207-7ra0g-ma19yknb3nyy28_tn
27909686866,"L-Carnitine 1500mg, giúp đốt cháy mỡ thừa [60 viên]",591360,5.0,https://down-vn.img.susercontent.com/file/vn-11134207-7ras8-m2nij6s6tqd6f9_tn
28974218121,"[March Bundle] [Rom&nd] Combo 2 son tint nước siêu lì, lâu trôi Hàn Quốc Romand Glasting Water Tint 4g",338000,5.0,https://down-vn.img.susercontent.com/file/vn-11134201-7ras8-mb3lww3psn9zb1_tn
28071151317,Combo 12 Gói Khăn Ướt Molfix Thiên Nhiên (100 miếng/gói),275000,4.67,https://down-vn.img.susercontent.com/file/vn-11134207-7ra0g-m6gf8nat43lk08_tn
20085282653,"Bộ tua vít cách điện TOLSEN 38012, bộ 5 cây tua vít cách điện 1000V",180000,4.94,https://down-vn.img.susercontent.com/file/vn-11134207-7r98o-lmx68hry5zvjd6_tn
2194817563,Bộ nồi chảo 3 đáy inox 403 Fivestar 5 món nắp kính tặng 5 muỗng ăn( N16cm x N18cm xN20cm x N24cm x chảo 24cm),1450000,4.94,https://down-vn.img.susercontent.com/file/sg-11134201-23010-pyvxnl7irgmvdf_tn
21881202903,Tã Quần Bobby/Baby Love Size XXXL 20-35 kg ( Siêu Tiết Kiệm ),202000,5.0,https://down-vn.img.susercontent.com/file/vn-11134207-7ra0g-m699ve2a154m3e_tn
18994841270,"Chảo INOX OLIVO STEVE X - Chống Dính Tự Nhiên, Đáy 5 Lớp, Đường Kính 24cm – Nấu Được Trên Mọi Loại Bếp-",1890000,5.0,https://down-vn.img.susercontent.com/file/vn-11134207-7ra0g-maduo6xbsy5405_tn
23887459846,Inssa Bộ Ấm Điện Dung Tích 1.5L Màn Hình LCD 8 Chức Năng Cài Sẵn YSHU001- Bảo Hành 1 Năm,669000,4.92,https://down-vn.img.susercontent.com/file/sg-11134201-7rdwo-mcimlfy6po12fe_tn
21484477670,"Thùng 4 Bịch Giấy Vệ Sinh Treo Tường 5120 Tờ Cute Dog, Khăn Giấy Treo Đa Năng Cao Cấp Chính Hãng",135000,4.85,https://down-vn.img.susercontent.com/file/vn-11134207-7ra0g-m77rjlutaiv0f0_tn
24291289337,"Máy Xay Ăn Dặm CHIGO 8 Lưỡi Cầm Tay Mini  Xay Siêu Mịn Thịt, Tôm, Cá, Rau, Củ, Quả ,Đa Năng  Cối Thủy Tinh 150W 330ml",229000,5.0,https://down-vn.img.susercontent.com/file/vn-11134207-7ra0g-m8fuvjv4j8uf6a_tn
26262640326,"Khuôn Gói Giò Inox 304 Dày Dặn Chắc Chắn Có Van Nén Ép Chặt | Khuôn Gói Giò Thủ, Giò Xào",270000,4.89,https://down-vn.img.susercontent.com/file/vn-11134207-7ras8-m0pj76lj6ajxb7_tn
2079272837,Dây Treo Tập Bụng 6 Múi ABS Trap,250000,4.95,https://down-vn.img.susercontent.com/file/3fa0727c74018c280da7c5339215c11b_tn
15991948079,"Combo Bột Rau Củ 7 Vị Detox Thải Độc Dalahouse, Bột Cần Tây, Rau Má, Diếp Cá, Cỏ Lúa Mì, Cải Xoăn, Củ Dền,Bó Xôi 63g",185000,4.95,https://down-vn.img.susercontent.com/file/vn-11134201-7ra0g-m6v46ybz62bc04_tn
4651286934,Tay vặn nồi áp suất Tay vặn nhựa chịu nhiệt - linh kiện nồi áp suất,25000,4.74,https://down-vn.img.susercontent.com/file/vn-11134207-7r98o-lzonra863ue995_tn
13493856800,Vòi Chậu Lavabo Lạnh Inax LFV-17,693000,5.0,https://down-vn.img.susercontent.com/file/13e7520fb03b4d5396079fe7bf421650_tn
26265985627,Purple fashionable men jeans gray slim fit elastic jeans high-quality casual brand jeans,734400,5.0,https://down-vn.img.susercontent.com/file/cn-11134207-7r98o-lndopeidxymz16_tn
29957895042,Tắm Trắng Cafe Cao Cấp 3 Trong 1 (LOẠI 1) giúp trắng da mờ thâm,12500,4.93,https://down-vn.img.susercontent.com/file/vn-11134207-7ra0g-m7jfonfp7e5y2e_tn
24082187115,Sách - Dưỡng Đường Đồng Hồ Cát - Bruno Schulz - FORMApubli - NXB Phụ nữ Việt Nam,127900,5.0,https://down-vn.img.susercontent.com/file/vn-11134207-7r98o-lwi31ixw7jkp9d_tn
28560604039,"Máy Xay Đa Năng Osaka Nhật Bản ,Máy Xay Sinh Tố,Thịt Cao Cấp-Lưỡi Dao Lớn Không Gỉ",89000,4.82,https://down-vn.img.susercontent.com/file/vn-11134207-7r98o-m0cl4zjy1rzh5b_tn
16580744180,Combo Dầu gội và sữa tắm Xmen 650g - Hương nước hoa nam tính,321000,4.71,https://down-vn.img.susercontent.com/file/vn-11134201-7ra0g-maego76lkfywec_tn
25451077506,"Tai Nghe Chụp Tai Không Dây Chồng Ồn Bluetooth DR58, Pin Đến 12 Giờ, Có Thể Gấp Gọn, Có Mic",178250,4.9,https://down-vn.img.susercontent.com/file/vn-11134207-7ra0g-m75o43eayjz523_tn
6076519677,Thẻ Nhớ Micro SD Hikvision Dahua Kingston  32/64/128/256Gb Hàng Chính hãng BH 2 năm,100000,4.86,https://down-vn.img.susercontent.com/file/vn-11134207-7r98o-lyvqk7fa55sx6b_tn
23426714549,Cốc Camping Inox 304 600ML Siêu Bền Đun Nước Nấu Ăn Khi Đi Dã Ngoại,39330,4.84,https://down-vn.img.susercontent.com/file/vn-11134207-7qukw-lfbishg0gf44ba_tn
26863413514,"Ấm Siêu Tốc Mini Lebenlang LBL2319, Sôi Nhanh Trong 4 Phút, Dung tích 500ML, Công Suất 600W",413000,5.0,https://down-vn.img.susercontent.com/file/vn-11134207-7ras8-m12k0loj3btr9d_tn
23559870561,"Máy Xay Nấu Sữa Hạt 8in1 VIFIBA Chính Hãng, Máy Làm Sữa Hạt 10 Lưỡi Dao, Dung Tích 1L VE14",2590000,4.54,https://down-vn.img.susercontent.com/file/vn-11134207-7ras8-m3e1pe2rap7l9f_tn
29684113318,Áo Kiểu Linen Viền Ren Tay Bo - Rattit Top Samtitclothing MA 380,89000,4.68,https://down-vn.img.susercontent.com/file/vn-11134201-7ra0g-m8sj4za60y1061_tn
25752123026,[Nhiều màu] Vỏ gối Cotton Tencel Châu Âu cao cấp Changmi Bedding siêu mềm mượt và mát lạnh - 1 chiếc,358964,5.0,https://down-vn.img.susercontent.com/file/vn-11134207-7r98o-lome9xi337jned_tn
23034519709,Khăn Ướt Khử Mùi Và Làm Mát Cơ Thể Cho Nam S Select Nhật Bản Gói 30 Miếng,122550,5.0,https://down-vn.img.susercontent.com/file/vn-11134207-7ras8-m0ldm2ylg06lf3_tn
18254482937,[LOẠI 1]Bộ bát đĩa 26 món bạch kim cho 6 người ăn.set bát đĩa 26 món cao cấp. bộ chén dĩa 6 người ăn,1395000,4.9,https://down-vn.img.susercontent.com/file/vn-11134207-7ras8-mcakhgqskchx43_tn
22653789850,Professional Gravity Feed Airbrush Air Compressor Kit for Art Painting Craft Cake Spray Model Air Brush Nail Tool Set,999350,5.0,https://down-vn.img.susercontent.com/file/sg-11134201-7rbm5-lla6nevnnynof2_tn
24870635082,Box fix Pin không cần cáp JC Q1 Battery Health Quick Repair,890000,4.94,https://down-vn.img.susercontent.com/file/vn-11134207-7r98o-lt90tnj8if1554_tn
27300400635,"Vật lý 12 Chương trình SGK mới: Sách Tổng ôn vật lý ôn thi thpt quốc gia 2025, đánh giá năng lực Moonbook",159000,4.87,https://down-vn.img.susercontent.com/file/vn-11134207-7ras8-m5zdsgybr6bc0d_tn
20694865547,"Combo 12 Bao Khăn Ướt Cồn LET-GREEN, 35 Miếng/Bao",360000,4.67,https://down-vn.img.susercontent.com/file/vn-11134207-7r98o-luetnjhb8sv33b_tn
24172899664,Bộ chia trứng Tay cầm dài Dụng cụ nhà bếp Vòng tròn bằng thép không gỉ Phễu Tách lòng đỏ trứng cho nhà bếp,56100,4.33,https://down-vn.img.susercontent.com/file/sg-11134201-7rcdf-ltuq97byb2ty62_tn
22870603685,"Combo Máy nguồn 15cell + sạc Hukan G1-P405, chân phổ thông, Dung lượng : 15CELL – 6.0Ah – Sạc: 1.5Ah",589000,4.98,https://down-vn.img.susercontent.com/file/vn-11134207-7ra0g-m810s6vnhapz1b_tn
21560808913,Màn Hình Di Động - Kết nối Type-C và HDMI - Màn Hình No Name,1650000,4.85,https://down-vn.img.susercontent.com/file/vn-11134207-7ra0g-ma0fr2aawxgu54_tn
24784131737,Máy hút bụi Siphon để làm sạch bể cá với máy hút,26400,4.82,https://down-vn.img.susercontent.com/file/sg-11134301-7rd4t-lx6vw6b0op583b_tn
2584379110,Nơ bê lễ - nơ bê tráp,8000,4.87,https://down-vn.img.susercontent.com/file/d258317c429aef4298d7647cc28f5538_tn
23970614083,Máy Câu Dọc Daiwa MG S LT | 2023,730000,5.0,https://down-vn.img.susercontent.com/file/vn-11134207-7r98o-lzafidbxp50h3e_tn
23940929569,Bút Thử Điện Thông Minh Không Tiếp Xúc Có Đèn Báo Tiện Dụng,18424,4.89,https://down-vn.img.susercontent.com/file/sg-11134201-7qvdj-lg3duicwyi524f_tn
26005882154,ĐỒNG HỒ ĐEO TAY ĐÈN LED PHÁT SÁNG BỀN ĐẸP CHO BÉ TRAI VÀ BÉ GÁI,29800,4.95,https://down-vn.img.susercontent.com/file/sg-11134201-7rdx8-lxw6ytr1xe2yf9_tn
25920534430,Dép xuồng nữ đế PU cao 9cm NGỌC TRINH STORE thiết kế phong cách hiện đại KB 05,104500,4.74,https://down-vn.img.susercontent.com/file/vn-11134207-7r98o-lt7t62eofw6173_tn
23950720592,"Máy khoan bê tông pin HUKAN HM21-G2-RH2603CP, Động cơ Không chổi than, Anti kickback",2199000,4.89,https://down-vn.img.susercontent.com/file/vn-11134207-7r98o-m03wm132y3db9f_tn
16093534177,HOBBYHUB 51mm/58mm Coffee Dosing Cup Kitchen Coffee Powder Brewing Bowl Tool Powder Feeder,71172,4.94,https://down-vn.img.susercontent.com/file/sg-11134201-7rdyl-m17hk1lne3blf8_tn
23933811476,Hạt Giống hoa tulip (tuylip) Janderwith Hà lan - 5 hạt - được chọn mix màu( ra hoa sau 50-65 ngày),9000,4.46,https://down-vn.img.susercontent.com/file/vn-11134201-7qukw-lensm3fva56b50_tn
21093463213,( Mẫu Mới - 2023 ) Nồi Cơm Điện Cao Cấp PVL đa chức năng  - Kiểu dáng Hàn Quốc - Bảo hành 12 tháng,385000,4.47,https://down-vn.img.susercontent.com/file/vn-11134207-7r98o-lsxnlzbf753t7d_tn
9643634292,Bỉm Trần Tã Quần/Dán Hipgig M/50 L/50 Xl/50 Xxl/50 Xxxl/50,105000,4.69,https://down-vn.img.susercontent.com/file/abee8f5ffb7d05ce9e9a738983037ab8_tn
23981404359,1 Miếng Đệm Bảo Vệ Đầu Gối Khi Chơi Thể Thao Chất Liệu nylon,52430,4.83,https://down-vn.img.susercontent.com/file/sg-11134201-7rbke-lm31b5f3lp74b4_tn
23978303450,Giấy hút màu quần áo Texlabs Usa chống loang màu phai màu hộp 100 tờ thấm màu Semewash cao cấp bền màu,118000,4.93,https://down-vn.img.susercontent.com/file/vn-11134207-7r98o-lx4yjb57ntuj3f_tn
23951635416,Bộ Kẹp Điện Thoại Gắn Chân Máy Ảnh Ren 1/4 Hoco .,25000,4.99,https://down-vn.img.susercontent.com/file/vn-11134207-7r98o-ll4xahaku5km89_tn
23953446030,"Nhân óc chó vàng sống đã tách vỏ thơm ngon tốt cho bà bầu và trẻ nhỏ 100g, 200g, 500g - Tiệm hạt lành",45000,4.95,https://down-vn.img.susercontent.com/file/vn-11134207-7r98o-lv3272dz6qrd99_tn
23969997108,Mô hình phụ kiện Honkai Star Rail (10 mẫu),99000,5.0,https://down-vn.img.susercontent.com/file/vn-11134207-7qukw-lhmr2f6co4n969_tn
25304878331,Set 15 Kẹp Tóc Nhỏ Dễ Thương Ngọt Ngào Thời Trang 2024 Cho Bé Gái,27540,4.77,https://down-vn.img.susercontent.com/file/sg-11134201-7rbna-lpost3eia85hfc_tn
16280627965,[HÀNG CAO CẤP] Thuốc Diệt Kiến Gián Home Care Chai 10mL Gấp Đôi Hoạt Chất Sinh Học - An Toàn - Hiệu Quả Cao,28000,4.87,https://down-vn.img.susercontent.com/file/8f90730384c4a41ca56171e5a63f8250_tn
29101852987,"Túi chườm lạnh bằng vải 6in, 9in",32000,4.91,https://down-vn.img.susercontent.com/file/vn-11134207-7ras8-m0r891bymutr9d_tn
24678078064,[ĐẶC BIỆT] COMBO NƯỚC HOA NAM - NỮ 10ML - CÀNG MUA CÀNG TẶNG,35100,4.75,https://down-vn.img.susercontent.com/file/vn-11134207-7r98o-lw9tqb6hinrv2e_tn
24114075190,[Livestream] Chảo chiên lòng sâu - Tefal So Chef 24cm,599000,4.86,https://down-vn.img.susercontent.com/file/vn-11134207-7ras8-m1dn7t28e87wfa_tn
23372206763,Pin Cell 18650 LiShen xám 2000mAh 10C 20A xả cao,42000,5.0,https://down-vn.img.susercontent.com/file/sg-11134201-7rdxs-lz0up9qi5wxy8d_tn
17220495357,"Túi zip chỉ đỏ (zip PE, zip lock, zip viền đỏ) loại dày – 5 giây",67320,4.96,https://down-vn.img.susercontent.com/file/vn-11134207-7r98o-m02r1yaur6y53d_tn
23975208076,1 Kẹp Tóc Hoa Dễ Thương 2.5inch,3402,4.8,https://down-vn.img.susercontent.com/file/sg-11134201-7qvdn-ljnqysdekjhz6b_tn
20485517352,Kính cường lực 9D Bảo vệ toàn diện Tương thích với IPhone 16 15 12 11 14 13Pro Max 15 XR X XS Max 15 7 6 16 6S 8 Plus Bảo vệ màn hình,25299,4.67,https://down-vn.img.susercontent.com/file/sg-11134201-7rbke-ln46t56qwnnqb2_tn
18359285927,Móc Khóa Banh Xù Mini Dễ Thương,15070,4.81,https://down-vn.img.susercontent.com/file/sg-11134201-22110-qvqq9dys3cjvb1_tn
23976867101,Cây giả - Cây bàng Singapore lá gân in 60cm,65000,5.0,https://down-vn.img.susercontent.com/file/vn-11134207-7qukw-lkgt8l20so7wa2_tn
21485349357,"Bàn là hơi nước thông minh Lebenlang LBL3087, thiết kế dáng đứng, công suất 1800W, bảo hành 2 năm",759000,4.84,https://down-vn.img.susercontent.com/file/vn-11134207-7ras8-mboqkayooley7f_tn
26313329179,"Sạc Pin Máy Khoan Chân Pin Phổ Thông,Đế Sạc 21V ,siết bulong, máy bắt vít",29000,4.71,https://down-vn.img.susercontent.com/file/vn-11134207-7ra0g-m6966zftepuf47_tn
23969225644,(mini) Album đựng card Genshin Honkai Identity V Kimetsu Gotoubun Jujutsu A6 16 ô binder sưu tập thẻ game anime chibi,28000,4.88,https://down-vn.img.susercontent.com/file/vn-11134207-7qukw-lha06ifpqr5f4b_tn
29753170392,"Nón bơi, mũ bơi. mắt kính bơi, kiếng bơi, kính tập bơi, đi biển cho bé trai, bé gái",49000,4.97,https://down-vn.img.susercontent.com/file/sg-11134201-7rd44-lwoecdyllcxlf1_tn
25250022639,"Dép đế xuồng nữ đế cao 5cm, dép bánh mì răng cưa chất EVA , chọn chuẩn size",55000,4.66,https://down-vn.img.susercontent.com/file/vn-11134207-7r98o-lnmmk6w4udbhfe_tn
23946470717,loa trợ giảng không dây RAYHAYES RN-1 Máy Trợ Giảng máy trợ giảng  Công Suất  Bluetooth 5.0 mic trợ giảng không dây,299000,4.74,https://down-vn.img.susercontent.com/file/vn-11134207-7ras8-m34el3om8xi330_tn
20458054392,Bộ Đồ Ngủ Liền Thân Hóa Trang Khủng Long Hoạt Hình Cho Nam Và Nữ,259200,4.7,https://down-vn.img.susercontent.com/file/sg-11134201-22100-64zj2yah16iv2b_tn
19001840205,Áo giữ nhiệt nam Thu Đông tay dài ôm body co giãn 4 chiều đẹp cao cấp VNO87,42900,4.83,https://down-vn.img.susercontent.com/file/vn-11134207-7qukw-lfhriio02t8547_tn
23933706489,dù che nắng ngoài trời/ô cute/Ô/Dù/Dù Che Mưa Nắng Hai Cách Sử Dụng Tối Giản Hình Hoa Tulip Niche,211477,4.84,https://down-vn.img.susercontent.com/file/tw-11134201-23030-a4syw04s8uov92_tn
10920195435,Bộ 7 đôi khuyên tai AHELLOGIRL tinh tế thời trang đơn giản thích hợp làm quà tặng,16500,4.81,https://down-vn.img.susercontent.com/file/cn-11134207-7qukw-ljgd6jd7sx2ud5_tn
26157916673,Truyện - Dấu Ấn Hoàng Gia lẻ tập  - NXB Kim Đồng,100000,4.92,https://down-vn.img.susercontent.com/file/vn-11134207-7ras8-mci52na02dcy96_tn
8318571965,"(B250) Túi, Bịch 100 găng tay nilon làm bếp, bao tay xốp dùng 1 lần tiện dụng, sạch sẽ",11200,4.67,https://down-vn.img.susercontent.com/file/vn-11134201-7r98o-m070j0007e6n34_tn
11999964526,Túi đựng máy đọc sách Kindle Paperwhite - Oz251,89000,5.0,https://down-vn.img.susercontent.com/file/vn-11134207-7r98o-ln846v588w8ja3_tn
23950061907,Thắt lưng da nam BBR dây da PU sần trơn mặt đúc logo chữ BT khắc chữ đơn giản đi học TL16P,114500,4.82,https://down-vn.img.susercontent.com/file/vn-11134207-7qukw-ljwg4wr3t96c32_tn
17282071067,Dây Da Bò Đan Kèm Móc Khóa Đồng Cá Tính Dùng Cho Ví Biker,250000,5.0,https://down-vn.img.susercontent.com/file/vn-11134207-7qukw-lf19jumc822y5d_tn
4072004520,(HSD 29.06.2025) Nước Dẫn Cân Bằng Kích Hoạt Da Toner Repair & Balance MEISHOKU 195ML,415000,4.86,https://down-vn.img.susercontent.com/file/vn-11134207-7ras8-m5lr69grujzse9_tn
20285638640,Nồi Chiên Không Dầu 5L Bear QZG-F15C7 - Hàng Chính Hãng,1490000,4.92,https://down-vn.img.susercontent.com/file/vn-11134201-7ras8-mc06g5virey2aa_tn
21364827447,Chai Thuỷ Tinh Nắp Dây Nắp Ko Dây Nắp Nhôm Bạc 150ML 300ML 500ML 750ML Đựng Saffon Mật Ong Trà Detox,12000,4.91,https://down-vn.img.susercontent.com/file/vn-11134207-7r98o-m04qov7bdl7317_tn
24376774382,[MÃ MỚI] Màn hình LCD Viewsonic VA220-H (21.5 inch/ 1920 x 1080/ 250 cd/m2/ 1ms/ 100Hz/VA) - Bảo hành 36 tháng,1719000,5.0,https://down-vn.img.susercontent.com/file/vn-11134207-7r98o-m05gt42nm50t7d_tn
13991125197,"Bộ Ga và Vỏ Gối Akemi Tencel Virtuous Empat sử dụng được 2 mặt, gồm 5 món (King / Queen)",2590000,5.0,https://down-vn.img.susercontent.com/file/vn-11134207-7qukw-lj11uw84f9ccd9_tn
22438200753,Bộ 10 Hạt Nhựa Acrylic Màu Sắc Sáng Tạo Dùng Làm Trang Sức DIY,23630,4.93,https://down-vn.img.susercontent.com/file/cn-11134207-7qukw-lfgnrh23uxxnb2_tn
1244123711,Sữa bột Abbott Grow Gold 3+ hương Vani 900g và 400g,650000,4.71,https://down-vn.img.susercontent.com/file/eb73e95a38629bce34fff36e2121882a_tn
26118600259,"Máy nén ép trị liệu suy giãn tĩnh mạch chân MTJ, có nhiệt sưởi cao cấp cho người bị suy giãn tĩnh mạch",2199999,5.0,https://down-vn.img.susercontent.com/file/vn-11134207-7ras8-m37id5j2mj8sef_tn
29855544181,"Bột uống Applied Nutrition Pump 3G Pre - Workout (With Caffeine) tỉnh táo, tăng sức bền hỗ trợ vận động",720000,5.0,https://down-vn.img.susercontent.com/file/vn-11134207-7r98o-lxtkvncw00k94a_tn
27354571292,"(Nồi hấp điện/chõ hấp điện) hấp bánh bao, xôi, thịt, bánh gai, bánh tẻ bằng điện gia đình 220v",1494000,4.57,https://down-vn.img.susercontent.com/file/vn-11134207-7ras8-m2z5yexctgj466_tn
17160464831,Giá kệ đỡ điện thoại hợp kim nhôm cao cấp xoay 360 độ để bàn xem phim livestream gấp gọn cho điện thoại máy tính bảng,4000,4.66,https://down-vn.img.susercontent.com/file/vn-11134207-7ra0g-m7dovdxzvcnsa4_tn
26800146449,"Túi chéo nam đeo ngực mini cao cấp đi chơi, du lịch nhiều ngăn, vải chống nước thời trang Ba Vy FASHION TĐC34AB",189000,4.94,https://down-vn.img.susercontent.com/file/vn-11134207-7ra0g-m8rcw5xr29heb6_tn
15697964401,Cần siết lực 3/8 inch chỉnh lực 10-60Nm WADFOW WWQ1D38[T04].113,655000,5.0,https://down-vn.img.susercontent.com/file/vn-11134207-7qukw-lke0ahb57e08ae_tn
25431553381,Babi Mami Kapibara mặt dây chuyền sang trọng Capybara túi đồ chơi trang trí búp bê móc khóa,74520,5.0,https://down-vn.img.susercontent.com/file/sg-11134201-7rd73-lvzhpir19ezvd7_tn
28663786617,"Miếng Lót Cảm Ứng Bếp Từ Silicon Cao Cấp Thương Hiệu KICHIN - Chống Trầy Xước Bếp, Chịu Nhiệt Cao",59500,4.9,https://down-vn.img.susercontent.com/file/vn-11134207-7ra0g-m70whnuiw1wh48_tn
26506266800,"Khăn Giấy Ướt Mini Dễ Thương Bỏ Túi Tiện Lợi 1 gói 8 tờ, Bịch 8 gói khăn giấy ướt Mini hoạt hình cao cấp bỏ túi an toàn",31000,5.0,https://down-vn.img.susercontent.com/file/vn-11134207-7r98o-ly5j2tlab63409_tn
29755069569,Lenovo ERAZER XT92 Tai nghe bluetooth Tai nghe không dây Bluetooth 5.4 HD Stereo Giảm tiếng ồn thông minh Cảm ứng chống nước có Mic,218900,4.81,https://down-vn.img.susercontent.com/file/cn-11134207-7r98o-lz0czpm1tgv6e9_tn
8178876723,Chuột game Logitech G102 gen 2 Lightsync LED RGB - Chính hãng BH 24 tháng,479000,4.89,https://down-vn.img.susercontent.com/file/vn-11134207-7ras8-m4ycuiaszmt27c_tn
1622441772,"Máy ép chậm công nghiệp SAVTM  JE 220-22M00A 200W  và JE220-18M00 . và JE220-24M00B , 250w miệng ép rộng,khỏe,",2680000,5.0,https://down-vn.img.susercontent.com/file/b6a54cffb994f667ec2d65b2abdddacf_tn
10372578253,Nồi Cơm Điện Tử Lòng Niêu Mishio MK300 1.2L,299000,4.85,https://down-vn.img.susercontent.com/file/vn-11134207-7qukw-ljc3vc5w79qk36_tn
22183451528,SADA Nồi cơm điện đa năng gia đình 5L hẹn giờ đặt trước thông minh làm nóng nồi cơm điện ba cấp độ tiết kiệm năng lượng,740300,4.8,https://down-vn.img.susercontent.com/file/sg-11134201-7rbnl-lmwmueb1l0cl7e_tn
24472284663,Dầu gội/ Ủ tóc/ Gói tóc/ Dầu tóc &honey Deep Moist 【Direct from Japan】,565126,5.0,https://down-vn.img.susercontent.com/file/vn-11134207-7ras8-m3ltyv8f2v1xe9_tn
26106176152,Sách - Ông Molloy (SAMUEL BECKETT) ( Nhã Nam HN Kho),152000,4.43,https://down-vn.img.susercontent.com/file/vn-11134207-7r98o-ly4o5qrt3nibe4_tn
21212026220,MIẾNG Nopull Disc / Miếng Nẹp Bump - Nẹp bump / Đệm siết,7000,4.82,https://down-vn.img.susercontent.com/file/sg-11134201-22100-e7erxdpg1wiv25_tn
28200006559,"Ghế massage KINGSPORT Standard G4 con lăn di chuyển cổ vai, thiết kế hiện đại 2024, túi khí massage tay dài",13260000,4.94,https://down-vn.img.susercontent.com/file/vn-11134207-7ra0g-madtce262yu011_tn
1086370772,"Hũ Thuỷ Tinh Tròn Nắp Thiếc 30ml | Đựng Mật Ong , Mứt Trái Cây",5600,4.88,https://down-vn.img.susercontent.com/file/vn-11134207-7ras8-m160b53oz0ca04_tn
23913136743,Màng Bọc Thực Phẩm 450 DA,80000,4.8,https://down-vn.img.susercontent.com/file/vn-11134207-7r98o-m04c2dj9rwr33b_tn
15290636007,Sữa Bột COLOS GLUCARE Nutricare Sữa Non Hỗ Trợ Miễn Dịch Cho Người Đái Tháo Đường GI Thấp Ổn Định Đường Huyết 850G,599000,5.0,https://down-vn.img.susercontent.com/file/vn-11134207-7ra0g-m9zay4ep51z82e_tn
8818296433,"5 cái - Nút chặn nhựa màu đồng chắc chắn dùng cho dây rút áo khoác, balo, túi, giày, cố định đồ vật",1700,5.0,https://down-vn.img.susercontent.com/file/vn-11134207-7r98o-ln8p7yyiiaqg74_tn
28776756271,QT Nồi Inox Nắp Kính 18cm Nutifood - Bibomart,319000,4.73,https://down-vn.img.susercontent.com/file/vn-11134207-7ra0g-m6gbnq6au8h34c_tn
23976821789,K110S K110 V977 RC Helicopter - Cờ Đuôi,15000,5.0,https://down-vn.img.susercontent.com/file/vn-11134211-7ras8-m2wnwqvlzk7a19_tn
24113573427,Máy Xay Thịt Inox 304 Không Gỉ Công Suất 250W 4 Lưỡi Sắc Bén Dễ Dàng Chế Biến Mọi Món Ngon (GVQ Store),149000,4.62,https://down-vn.img.susercontent.com/file/vn-11134207-7r98o-lsc5hfnc4yope0_tn
24115461900,Set Quà Cốc Ly Sứ Sành In Hình Ngộ Nghĩnh Quà Tặng Sinh Nhật Gia Đình Người Yêu Bạn Bè ChieHouse,185000,4.91,https://down-vn.img.susercontent.com/file/vn-11134207-7ra0g-m7n5pcy3llf563_tn
22772829587,Tai nghe không dây nhét tai SOUNDPEATS Air4 Bluetooth 5.3 có 6 micro chống ồn hiệu quả,1099999,4.87,https://down-vn.img.susercontent.com/file/cn-11134207-7qukw-liuzrwpaxn5i90_tn
25718141101,"Nồi cơm điện tử Elmich RCE-1789 - 1,2L, đa chức năng, Lòng niêu, nấu cơm ngon với công nghệ nấu 3D.",1290000,4.72,https://down-vn.img.susercontent.com/file/vn-11134207-7ras8-mc3ph6ym12eqda_tn
26467952898,"Dreame phụ kiện Robot Hút Bụi L30S Ultra, Chổi chính, Chổi cạnh, Khăn Lau Túi đựng rác, nắp đậy chổi giữa Màng lọc Hepa",42000,5.0,https://down-vn.img.susercontent.com/file/vn-11134207-7ras8-m2qinrx12j2e47_tn
23926869599,Bộ thực hành motor phát điện gió mini học tập thí nghiệm stem - CBGD3,29900,4.9,https://down-vn.img.susercontent.com/file/vn-11134201-23020-djehtic6tvnved_tn
21965696134,Bình nước thể thao GYMPRO 500ml - 2600ml tạo hình quả tạ,122500,4.63,https://down-vn.img.susercontent.com/file/cn-11134207-7r98o-lkklh8vttprw90_tn
29357634608,len nhung  đũa +-100gr,17900,4.93,https://down-vn.img.susercontent.com/file/vn-11134207-7r98o-m09fok5geqjx15_tn
23951058874,Mô-đun cần điều khiển điện từ GuliKit cho sàn hơi nước OLED / sàn hơi nước LCD GuliKit SD02 / GuliKit SD05 Tương thích với cần điều khiển loại A và loại B Không cảm biến hiệu ứng hội trường trôi dạt,579999,4.89,https://down-vn.img.susercontent.com/file/cn-11134207-7r98o-lvk3yont497qfc_tn
23949340564,Áo Khoác Bóng Chày Khóa Kéo Thời Trang Dành Cho Bé Trai,195000,5.0,https://down-vn.img.susercontent.com/file/sg-11134201-7qve1-ljm7s70bkl7v8b_tn
28955614020,"Máy Giặt Mini Gấp Gọn - Máy Giặt Đồ Đồ Lót,Tất Vớ, Giặt Đồ Cho Bé Tự Vắt Khô Khử Khuẩn Bằng Công Nghệ Ánh Sáng Xanh",229000,4.61,https://down-vn.img.susercontent.com/file/vn-11134201-7r98o-lxupyrhvsp977f_tn
24467373461,Tai Nghe Không Dây  Baseus E16 / AS01 TWS Bluetooth 5.3 Có Hai Micro ENC Nhét Trong Chống Ồn điều Khiển Bằng Cảm ứng,299000,4.81,https://down-vn.img.susercontent.com/file/vn-11134207-7ras8-m401qlbb1ryndc_tn
