id,title,final_price,rating,image
20625129230,Laptop Dell Latitude 7490 Core i7-Gen 8 Ram 16G SSD 256 Màn Full HD Đẹp 99% Bất Chấp Giá Zin mỹ,6534000,4.98,https://down-vn.img.susercontent.com/file/vn-11134207-7qukw-ljlljl46ykg293_tn
6817436757,Nước hoa các hương thơm giữ mùi lâu,12425,4.37,https://down-vn.img.susercontent.com/file/vn-11134207-7ras8-m2jmpkfy9584dd_tn
29854582337,Chiếu Điều Hòa Cao Su Non Latex 5D Mẫu Mới - Chiếu 5d cao su non siêu mát tặng kèm 2 vỏ gối,320000,5.0,https://down-vn.img.susercontent.com/file/vn-11134207-7r98o-lxc8jszebmqj4b_tn
9474640678,"Bộ vòi hoa sen, tay sen mỏng mạ Crom tăng áp lực cao mạnh mẽ phù hợp với các loại củ sen, cây sen",58500,4.76,https://down-vn.img.susercontent.com/file/4ec76931075e314cc2ff7912010107d6_tn
28506626557,"Cao Su Trắng Trong Khổ 2m -> 4m {GIÁ BÁN 1 MÉT TỚI}, Bạt PE Trắng Cách Nhiệt, Ngăn Nước Mưa Lấy Sáng, Đậy Đồ Tránh Bụi",45900,4.68,https://down-vn.img.susercontent.com/file/vn-11134207-7ra0g-m6fknsqxqteg14_tn
29455986295,[Anran] Áo Ngực Thể Thao Thời Trang Gợi Cảm Xếp Ly Bên Ngực Áo Ngực Thường Ngày Phòng Tập Gym Khiêu Vũ,300240,4.55,https://down-vn.img.susercontent.com/file/sg-11134201-7rdvj-m1gnto66c4sodb_tn
26807065684,"[3-5 Tầng ALL SIZE KỆ] professionall.-Kệ nhựa có bánh xe 4 tầng, Xe Đẩy Để Đồ Đa Năng Kệ Tiện Lợi",115500,4.45,https://down-vn.img.susercontent.com/file/cn-11134207-7ras8-m34tfe9eru2ye0_tn
16699118131,Cậu bé bóng chuyền Kageyama Doudou Búp bê bông Kageyama Tobio,394980,4.89,https://down-vn.img.susercontent.com/file/vn-11134201-7r98o-lmmoj7gi0cm7cd_tn
23979806688,Chậu nhựa vuông V25(cao 25cm x miệng 25cm) loại dày cao cấp,29500,4.75,https://down-vn.img.susercontent.com/file/vn-11134207-7r98o-llgjh6ukga7qdf_tn
27910274607,Nồi Lẩu Điện Bear 5L SB-NL05F - Công suất 1500W - 4 mức nhiệt,725000,5.0,https://down-vn.img.susercontent.com/file/vn-11134207-7r98o-lzsrcv83tkr124_tn
27168593273,"Nồi gang MINLIA, có nắp gỗ Tay cầm hai tai Nồi, Nồi chống dính Không phủ Nồi súp phong cách Nhật Bản Sử dụng tại nhà",189090,5.0,https://down-vn.img.susercontent.com/file/sg-11134201-7reqa-m304tqhofngp89_tn
15594773976,"Tai nghe có dây F4 chống ồn cực tốt, tai nghe gaming F4 không có độ trễ âm thanh super bass có mic",150000,4.91,https://down-vn.img.susercontent.com/file/sg-11134201-22110-487j2t4acnjv0b_tn
18895696535,"[ VÀNG MÃ] BỘ ĐỒ CÚNG THÔI NÔI , ĐẦY THÁNG BÉ TRAI , BÉ GÁI NHIỀU TONE MÀU ( CÓ VĂN KHẤN )",149000,4.94,https://down-vn.img.susercontent.com/file/vn-11134207-7ras8-m1u2pwsm46v395_tn
23943185885,"Bàn phím cơ chính hãng HP GK100F kết hợp Bàn phím cơ trục xanh game có đèn nền 104 phím Led,giao diện USB [HCM]",369000,4.85,https://down-vn.img.susercontent.com/file/vn-11134207-7qukw-lh4nef0jrjzna6_tn
23579085440,giày cao gót 9cm da bóng quai ngang bít gót xoàn 1cm cực sáng siêu đẹp hót treand. - A1,125000,4.81,https://down-vn.img.susercontent.com/file/vn-11134207-7ras8-m1w8vphup70f56_tn
23948440073,"Loa Bluetoooth Karaoke YS-105, Kèm Micro Không Dây Nhỏ Xinh, Chức Năng Đổi Giọng Đăc Biệt, Bảo Hành 12 Tháng",403000,5.0,https://down-vn.img.susercontent.com/file/vn-11134207-7qukw-ljb1sjde9ej656_tn
4528970582,"Bộ pyjama nam dài tay vải lụa satin mềm mại, thoáng mát N9371 - Thời Trang Dương",459000,4.86,https://down-vn.img.susercontent.com/file/vn-11134211-7r98o-lt3ammiq5yo4e8_tn
19793058695,"[Giá dùng thử] Miếng lót bổ sung tiết kiệm Canny dán vào tã quần, tã dán hoặc quần vải",11000,4.89,https://down-vn.img.susercontent.com/file/vn-11134201-7ras8-m3wc1x3yiv1kc5_tn
23953241930,"Bình Trường Phúc cao 23,5cm, gốm Chu Đậu, họa tiết hoa Phù Dung truyền thống vẽ thủ công dưới men",395000,4.91,https://down-vn.img.susercontent.com/file/vn-11134207-7r98o-ll4gv9r8vf7s33_tn
25020225324,Nam Unsex Thép không gỉ Lịch chống nước Đồng hồ thạch anh Thời trang Đồng hồ nữ thông thường A138 LTP-E117D,143000,4.75,https://down-vn.img.susercontent.com/file/cn-11134207-7r98o-lvsl039inia618_tn
22275156697,"Lắc chân titan hột bi 3 li, Vòng chân titan bi không phai không rỉ màu 18k, trangsucmoiluatuoi.RIN",79000,4.81,https://down-vn.img.susercontent.com/file/vn-11134207-7qukw-ljpuc1io1uwk43_tn
24931220928,Máy Làm Sữa Hạt Mini OLIVO CB1000 Dung Tích 1L - Xay Nấu Đa Năng Chống Trào Tuyệt Đối - Nắp Kính-BH12T chính hãng Talaha,1990000,5.0,https://down-vn.img.susercontent.com/file/vn-11134207-7r98o-lvr8mnr44kmxba_tn
24707432072,"Bàn ủi hơi nước cầm tay gập gọn SOKANY công suất 1500W giúp ủi nhanh mọi loại vải, ủi được vải len quần jean Fine",896000,5.0,https://down-vn.img.susercontent.com/file/9c91933a514ba8d500ff77496b2984d7_tn
16493732090,"Thắt lưng Nam CTL68_Dây dù siêu bền_Khóa tự động sang trọng, tiện dụng - Dây nịt Nam",149000,4.92,https://down-vn.img.susercontent.com/file/vn-11134207-7ra0g-m74kfcpdehbsdc_tn
23952880011,"Áo cotton dài tay đính gấu thêu cho bé trai, bé gái sơ sinh 4-12kg, Chất cotton QC cao cấp. Stella shop",59000,4.9,https://down-vn.img.susercontent.com/file/vn-11134207-7r98o-ll0ghodiyksr47_tn
23540329963,Combo 10 Đôi Găng Tay Chống Nắng Xỏ Ngón Nam Nữ Vải Dày Dặn Co Giãn,48000,4.31,https://down-vn.img.susercontent.com/file/vn-11134207-7qukw-lhk7xrn415dxd8_tn
29907726595,Bộ đùi thun cotton bé gái Hozzy size đại 20-45kg chất vải xuất dư 100% cotton thấm mồ hôi,109000,4.96,https://down-vn.img.susercontent.com/file/vn-11134207-7ra0g-m90iitsvsgvi20_tn
7916467307,"Băng cổ chân, bó gót chân Yasu 7326 ( 1 Chiếc )",39000,4.9,https://down-vn.img.susercontent.com/file/vn-11134207-23010-ouc2tdoa55lvba_tn
23876109699,"Cục Đẩy Công Suất 2 Kênh Martin 3 Sao Hàng Bãi 2X850W, 28 Sò Bù Áp - 16 Sò, 8 Tụ Lọc, Nguồn Xuyến",2650000,4.97,https://down-vn.img.susercontent.com/file/vn-11134207-7ras8-m1htuqzuvqgv8d_tn
10067589279,"Hộp qua tặng hoa hồng Miuu Silver, quà tặng sinh nhật, valentine De Rose",650000,4.96,https://down-vn.img.susercontent.com/file/d148c1c617a538ab966e432f5e0e8e8a_tn
12372548193,"Bộ Đèn thờ vĩnh cửu, sử dụng pin, kiểu đèn dầu rất đẹp, dùng để bàn thờ, thờ phật, bóng led tiết kiệm pin",145000,4.59,https://down-vn.img.susercontent.com/file/vn-11134207-7r98o-loq8x8naplord0_tn
22256188804,Túi đeo chéo nam nữ Ba Vy FASHION cỡ lớn nhiều ngăn phong cách Hàn Quốc đựng điện thoại đi chơi TĐC22AB,128000,4.9,https://down-vn.img.susercontent.com/file/vn-11134207-7r98o-ltv9hbpciyvec7_tn
26819169932,Máy Ép Mía Để Bàn F3 400w Lô Kim Cương inox 304  Ép 1 Cây Mía Mô Tơ Nhật 400w  Ép Mía Siêu Khỏe,4800000,5.0,https://down-vn.img.susercontent.com/file/vn-11134207-7ras8-m363yzby6v4p62_tn
24378414485,MÁY ÉP CHẬM SUNHOUSE SHD5516 _công suất 150w có tích hợp chức năng làm kem trái cây,1329000,5.0,https://down-vn.img.susercontent.com/file/sg-11134201-7rd74-luvucshx3nyxd2_tn
25595577081,Sổ lò xo A5 Campus 2 đầu hạn chế cấn tay khi viết BST Check&Bar 160tr KẺ NGANG vpp Diệp Lạc,27720,5.0,https://down-vn.img.susercontent.com/file/vn-11134207-7ras8-mapfhlu9yk0o8e_tn
29758991661,Túi Bao Nửa Máy Ảnh Da Dành Cho Máy Ảnh Fujifilm XT30II XT30 Mark II X-T30 XT20 X-T20 XT10 X-T10,194400,4.56,https://down-vn.img.susercontent.com/file/cn-11134207-7r98o-lzbhls41m84i31_tn
25657981922,"Khăn Giấy Ướt RICO BABY Premium Nội Địa Hàn Lành Tính, Sạch Khuẩn, An Toàn Cho Bé Phân Loại 20 Tờ, 70 Tờ",38000,5.0,https://down-vn.img.susercontent.com/file/vn-11134207-7r98o-lo6ql2fu5u5z60_tn
17884825742,Tế bào gốc tăng trưởng tế bào EGF DR.SHELDING (sẹo rỗ),279000,5.0,https://down-vn.img.susercontent.com/file/vn-11134207-7qukw-ljmvp6umwrsk14_tn
11586656954,COMBO 10 GÓI KHĂN ƯỚT FRESSI ALL CARE 20,100000,4.98,https://down-vn.img.susercontent.com/file/vn-11134207-7qukw-lj0zx1n3v0lu07_tn
29168829255,"(Hàng Cao Cấp) Khăn Giấy Uớt Không Mùi BABY TATTOO Dành Cho Bé Gói 20 Miếng, Gói 80 Miếng Tiện Lợi",9900,5.0,https://down-vn.img.susercontent.com/file/vn-11134207-7ras8-m31vdxoiuw8qa5_tn
19679424615,Lồng cơm giữ nhiệt văn phòng Mitomo LCH-7086 bằng inox gồm 3 khay riêng biệt dung tích 2.3L,683000,4.86,https://down-vn.img.susercontent.com/file/vn-11134207-7qukw-lgqb3kymbrxu2a_tn
6742995992,"Nước mơ cô đặc hàn quốc, nước mận xanh hàn quốc 1,025kg - 매실청",230000,5.0,https://down-vn.img.susercontent.com/file/vn-11134207-7r98o-lm7kmqe3xqzj22_tn
8134387682,"[Chính hãng - Giá Sốc] Tất Nam Nữ Muji Cao Cấp Hộp 10 Đôi Vớ Kaffdare Xuất Nhật, khử mùi chống hôi chân",89000,4.81,https://down-vn.img.susercontent.com/file/6c4479041b85bf04167ea8208f49d2c0_tn
22678739019,"Khăn lau rửa xe ô tô siêu thấm hút nước, lau bếp, lau kính chuyên dụng có 2 bông mặt cao cấp 88419",1000,4.75,https://down-vn.img.susercontent.com/file/vn-11134207-7r98o-ll4mzbdsgcl290_tn
5840157784,Cà vạt nam KING cho chú rể và công sở cavat họa tiết vải silk lụa mịn hàn quốc cao cấp thắt sẵn dây kéo 8cm giá rẻ C0020,30319,4.86,https://down-vn.img.susercontent.com/file/91723d8b876cda62c03c5e51c98b7aab_tn
26301334854,CHẢO INOX 3 ĐÁY FIVESTAR LÒNG INOX CÁN NHỰA CHỐNG NÓNG,205000,4.81,https://down-vn.img.susercontent.com/file/vn-11134207-7ras8-m114dn0ib8gv57_tn
23907152503,Vỏ Bảo Vệ Hộp Sạc Tai Nghe Airpods Pro 2 & 1 Bằng Silicon Siêu Mỏng Chống Trượt Tiện Dụng Ốp,21492,4.48,https://down-vn.img.susercontent.com/file/sg-11134201-22110-e6co3nrai9jv94_tn
25374558459,Mã kính lưng Thay Thế Cho Thợ Sữa Chữa 13/13pro/13promax tặng keo GiaHungShop,98770,4.86,https://down-vn.img.susercontent.com/file/sg-11134201-7rd61-lu6lggz78onaff_tn
23969681920,Realme C61 C63 C53 2023 Kính Cường Lực Riêng Chống Gián Điệp Full Cover Bảo Vệ Màn Hình Chống Peek Phim Riêng Tư Cho Realme C53 RealmeC53 C 53 53 53C 2023 4G 5G Phim Bảo Mật Chống Peek,33000,4.73,https://down-vn.img.susercontent.com/file/sg-11134201-7qvd5-lhhebl86wd1ca9_tn
23905586800,MAFILOP  [Ready Stock] Temperature Meter With Clock LCD Digital Hygrometer Indoor Outdoor Weather Station HTC-1 HTC-2,65450,4.17,https://down-vn.img.susercontent.com/file/sg-11134201-7rffn-m34xqo2qsm5uf5_tn
17716096586,Bẫy Chuột Thông Minh Loại Cạm Kẹp Dễ Sử Dụng.Hiệu Qủa.Không Độc Lại.Lực Cắn Mạnh.Chất Liệu Nhựa Cao Cấp,2490,4.74,https://down-vn.img.susercontent.com/file/vn-11134207-7r98o-ltnmagiqex3e89_tn
26671402738,Combo 2 Bịch bỉm Unijoy Baby Oxygen Care Quần/Dán mềm mỏng đủ Size NB - 4XL an toàn cho bé,737500,5.0,https://down-vn.img.susercontent.com/file/sg-11134201-7rfgb-m446nzb4akuz6c_tn
5132323687,"Thác khói trầm hương đốt - Thiên Mộc Hương - Xông nhà, văn phòng, nhang trầm sạch, nhang thơm",195000,4.83,https://down-vn.img.susercontent.com/file/vn-11134207-7ra0g-m70bervmct2w98_tn
18086127127,"Nồi Cơm Điện GUGKOO 1.2L / 2L Công Nghệ Nấu 3D Hàn Quốc, Rẻ, Bền, Đẹp Lòng nồi siêu dày nấu cơm ngon",375000,4.68,https://down-vn.img.susercontent.com/file/vn-11134207-7r98o-lzaxfethv2chb9_tn
8105656541,"laptop 2 trong 1 Fujitsu Arrows Q507 Atom x5-z8550, 4gb ram, 128gb ssd, 11.5inch Full HD sản phẩm cũ đã qua sử dụng",1400000,5.0,https://down-vn.img.susercontent.com/file/9eba76e556ceb9bf912f6de1790b237d_tn
24731631966,Dung dịch nhỏ mắt - dưỡng mắt DEEP COOL,43650,5.0,https://down-vn.img.susercontent.com/file/vn-11134207-7ras8-m52ar6udak1v7a_tn
24344233402,"Đai Lưng Chống Gù Y Tế Cao Cấp Haruco Nam Nữ, Cải Thiện Vóc Dáng, Định Hình Cột Sống, Thoáng Khí",399000,4.88,https://down-vn.img.susercontent.com/file/vn-11134207-7ra0g-m8q2tcpfzybm27_tn
29751470404,Sữa Rửa Mặt Bioderma Sebium Gel Moussant 45ml - 100ml - 200ml,105000,5.0,https://down-vn.img.susercontent.com/file/vn-11134207-7r98o-lwcmx4jxzxsp08_tn
23789699570,"Giỏ đựng hoa quả để bàn, kệ đựng đồ nhà bếp đa năng thiết kế 3 tầng trẻ trung sang trọng Dailymall",239000,5.0,https://down-vn.img.susercontent.com/file/vn-11134207-7r98o-m013pvockx8t38_tn
29256178762,"[VNXK] Kẹp Inox  gắp thức ăn, thịt nướng BBQ, kẹp đa năng MYCOOK",38000,5.0,https://down-vn.img.susercontent.com/file/vn-11134207-7r98o-ly4qoi5boybn3a_tn
29462752140,"Combo 2 dao thái vuông + vát Đức  thép liền cán, cán gỗ",205000,5.0,https://down-vn.img.susercontent.com/file/vn-11134207-7ras8-m0s352v2g6b1d6_tn
25707348086,NỒI BẾP CHIÊN NHÚNG 6 LÍT,100000,5.0,https://down-vn.img.susercontent.com/file/vn-11134207-7r98o-m03tv6k2f72n16_tn
27459770721,Bông tai rỗng hình học không đều bằng kim bạc 925 Ngọc trai Hàn Quốc,10626,4.94,https://down-vn.img.susercontent.com/file/sg-11134201-7rdye-lzke6j6ltv8i14_tn
17194449810,Áo Ngực Ren Siêu Mỏng Có Gọng Thép Phong Cách Pháp Quyến Rũ Cho Nữ,96120,4.6,https://down-vn.img.susercontent.com/file/cn-11134207-7qukw-li5r7ercalbue2_tn
23061898710,Máy Làm Sữa Hạt Mini OLIVO CB400 PRO 600ml – Máy Xay Nấu Đa Năng – Nắp Inox 304 – Lưỡi Dao 10 Cánh,1890000,4.97,https://down-vn.img.susercontent.com/file/vn-11134207-7ras8-mbni4lvbdywk66_tn
29500284080,Dầu gội khô Batiste Dry Shampoo 200ml giúp tóc bồng bềnh sạch dầu nhờn trong 1 phút,160000,5.0,https://down-vn.img.susercontent.com/file/vn-11134207-7r98o-lvfjwl54ffc49f_tn
18394296262,Nước tẩy trang Loreal Paris 3-in-1 Micellar Water làm sạch sâu 400ml,114000,4.65,https://down-vn.img.susercontent.com/file/vn-11134207-7ras8-m0ld4vl9xnfx59_tn
23925648522,"Mực bơm máy in CanonLBP 223dw, 226dw, 233dw, 227dw, 228x, 443dw, 445dw, 448dw Lọ hủ bình nạp hộp mực",33000,5.0,https://down-vn.img.susercontent.com/file/vn-11134207-7ras8-m2lwrwnks0cade_tn
29401128213,"Máy Hút Bụi Cầm Tay SEKA SK-09 PLUS Nâng Cấp Toàn Diện, Hút Bụi Lau Sàn, Tự Động Làm Sạch Con Lăn",1250000,4.75,https://down-vn.img.susercontent.com/file/vn-11134207-7ra0g-m6rmj64diild44_tn
27609757047,"ZUOGUAN Giỏ lưu trữ tai mèo mới, dây bông dệt tay, tủ đầu giường, giỏ lưu trữ đồ lặt vặt",84240,5.0,https://down-vn.img.susercontent.com/file/sg-11134201-7rdvs-lzljvlbfiwkibf_tn
23978271894,Ví Dài Sức Chứa Lớn Có Khóa Vương Miện Đa Năng Phong Cách Nhật Hàn Phổ Biến Dành Cho Nữ Sinh,66960,4.54,https://down-vn.img.susercontent.com/file/cn-11134207-7r98o-lv2v98dufjrhca_tn
26562553564,"Nồi kho hầm nấu chậm đa năng UNIE, 8 chức năng kho hầm, Lòng nồi gốm cao cấp",989000,5.0,https://down-vn.img.susercontent.com/file/vn-11134207-7ra0g-m7d83ge201rw05_tn
25771392642,[GT1] Bộ chuyển đổi kết nối Apple Carplay/Android auto CÓ DÂY thành KHÔNG DÂY 4 trong 1,1250000,5.0,https://down-vn.img.susercontent.com/file/vn-11134207-7r98o-lueoygucavblc8_tn
27470366644,"Chảo xào sâu lòng Chockmen size 24cm kèm vung kính, chất liệu thép không gỉ 18/10 CKM650",605000,5.0,https://down-vn.img.susercontent.com/file/vn-11134207-7ras8-m3naut9467jwee_tn
4974764074,Giày Sneaker Vải Canvas Unisex D27 White DINCOX Đơn Giản Hiện Đại,379000,4.91,https://down-vn.img.susercontent.com/file/vn-11134207-7ra0g-mahtta9kf7bsf6_tn
27360341113,Nồi cơm điện tử cao tần Tefal mini 0.7L RK604165 - SSHOP MALL,3959011,5.0,https://down-vn.img.susercontent.com/file/sg-11134201-7rdws-lzt9auxvxp1i0f_tn
22549221297,"Ly uống nước dễ thương thuỷ tinh, Cốc thuỷ tinh miệng loe, vân sọc siêu xinh (240ml/370ml)",10000,4.92,https://down-vn.img.susercontent.com/file/vn-11134207-7qukw-ljkou9ntz2yc00_tn
13521640275,Bàn ủi hơi nước Philips GC1756 2000W,1099000,4.55,https://down-vn.img.susercontent.com/file/sg-11134201-7ra0m-m4j12bwkghhf4f_tn
25435277052,Máy Xay Sinh Tố Cầm Tay Mini Ostmars Sạc Tích Điện 10 Lưỡi Dao Dung Tích 500ml Đa Năng Nhỏ Gọn,235000,4.92,https://down-vn.img.susercontent.com/file/vn-11134207-7r98o-lvcpsfvfhy1920_tn
23979259684,Đệm Bọc Bảo Vệ Tai Nghe Chụp Đầu,17164,5.0,https://down-vn.img.susercontent.com/file/sg-11134201-7r98o-llaboej4rbjpd5_tn
25359008915,(tặng vòng) Đồng hồ nữ Bonnie DÂY RÚT hợp kim hoa 4 cánh,78260,4.89,https://down-vn.img.susercontent.com/file/vn-11134207-7r98o-lwdxfbrk3sgp28_tn
19039715961,Combo 3 Thịt Chua Hương Mường - Thịt Chua Trường Foods 160g - Chi Nhánh Hà Nội,156000,4.87,https://down-vn.img.susercontent.com/file/vn-11134207-7r98o-lyyj2ys9xew148_tn
9258704324,"Máy Siết  Bulong Máy Vặn Vít MA.KITA 199v 6A 380N/m. 2PIN Tặng Bộ Phụ Kiện, Chuẩn Loại 1, Động Cơ Không Chổi Than",841300,4.76,https://down-vn.img.susercontent.com/file/vn-11134207-7r98o-lzuzk01ovag1e6_tn
29820555129,Hộp trà thiếc hình trụ hoạ tiết hoa văn in nổi cao cấp - TEA BOX,62000,5.0,https://down-vn.img.susercontent.com/file/vn-11134207-7ra0g-m7krfjfv9thf36_tn
25525699304,Kẹo UHA Trà Xanh Matcha Nổi Tiếng - Nội Địa Nhật Bản 58G- Date 2027,37000,4.97,https://down-vn.img.susercontent.com/file/vn-11134207-7r98o-luce4vbdrvvj59_tn
27514314102,"Máy Ép Chậm Lorca TA 955 SJG Ép Trái Cây Nguyên Quả Kiệt Bã Dung Tích 0,6L Làm Nước Ép",2934000,5.0,https://down-vn.img.susercontent.com/file/vn-11134207-7ra0g-m7mjkei4l85f32_tn
24811355516,Casetify Vỏ Acrylic Cứng Cho IPhone 15 14 11 12 13 Pro Max Ốp Lưng Rồng Mây Tốt Lành 14Plus 15Plus 12Pro Ốp Lưng Chống Sốc Trong Suốt,167400,5.0,https://down-vn.img.susercontent.com/file/sg-11134202-7rcfd-lr2rmrbu9ovt7e_tn
17986863431,Sữa tươi nguyên kem dạng bột HORIZON Organic Dry Whole Milk 870g - Mỹ,799000,5.0,https://down-vn.img.susercontent.com/file/vn-11134207-7r98o-lu7jw2x8vw9d59_tn
11063733442,Ấm siêu tốc 1.8L- bình đun nước nóng,68000,4.78,https://down-vn.img.susercontent.com/file/65d10c6e8d0a9bf9ffa64cd58814caf3_tn
15808951290,"Khuôn bánh chưng , khuôn gói bánh tiện lợi bằng gỗ",35000,4.63,https://down-vn.img.susercontent.com/file/22f908b05f93265ab04a654b0ad107e5_tn
24701862529,Dây thừng cotton đỏ 2mm làm thủ công trang trí 20m,10500,5.0,https://down-vn.img.susercontent.com/file/vn-11134207-7r98o-loh2q9rhtg3b75_tn
23954919198,"Nhựa đen bóng 8 món xe điện Xmen dán sẵn tem hổ, tem chỉ đỏ, tem số 7, tem cờ ý,……",430000,4.4,https://down-vn.img.susercontent.com/file/vn-11134207-7ras8-m0fbtiopbzwv73_tn
24188754219,(0đ Giao Lắp HN-HCM-ĐN-BD) Google Tivi Xiaomi A 43 inch L43MA-AFSEA 2025 Chính Hãng Bảo Hành 24 Tháng,6490000,5.0,https://down-vn.img.susercontent.com/file/sg-11134201-7rfhx-m9pnrym4rf0gdf_tn
28209725457,Gối Tự Lưng - Gối Tựa Đầu Ô TÔ -Gối tự lưng văn phòng Cao Su Non -Chống Đau Mỏi Cổ Và Cột Sống - TH OFFICIAL,498000,5.0,https://down-vn.img.susercontent.com/file/vn-11134207-7r98o-lzvtgq696uu934_tn
23930562131,Lót Sàn 2 Mảnh Mẫu 2023 Cho Các Dòng Xe Sprint Primavera,229000,4.89,https://down-vn.img.susercontent.com/file/vn-11134207-7r98o-lz4ctf5flbnxad_tn
22683475428,Đầm corset Ôm Dáng Phong Cách gothic Gợi Cảm Thời Trang Mùa Thu Hàng Mới Dành Cho Bạn Nữ,144018,5.0,https://down-vn.img.susercontent.com/file/sg-11134201-7rbnh-llx5ly6czgeo37_tn
28109175825,Dao quắm phát cây cỏ phát nương dẫy dày dặn chắc khoẻ cán 30cm,85000,4.95,https://down-vn.img.susercontent.com/file/vn-11134207-7r98o-lzf4ah2im91p32_tn
28357788698,"Sữa Mama care Mothers Nutrition Nourishing Life cho người trước, trong và sau bầu - Hộp 480g",595000,5.0,https://down-vn.img.susercontent.com/file/vn-11134207-7ras8-m2kihig1caey8c_tn
29268197441,Chảo Chiên Trứng Chống Dính 4 Lỗ Hình Trái Tim,67200,4.41,https://down-vn.img.susercontent.com/file/vn-11134207-7ras8-m2tobcqjw64m40_tn
23966098162,Camera Wifi Ngoài Trời Ezviz H3 Phiên Bản 3MP và 5MP Siêu Nét Có Màu Ban Đêm - HKT STORE,1215000,5.0,https://down-vn.img.susercontent.com/file/vn-11134207-7qukw-lg0dt80xer1me7_tn
23920219260,"[Quà 8.3] Nước giặt xả hữu cơ Fuwa3e enzyme sinh học từ vỏ dứa 3.5L - giặt đồ trẻ em, đồ lót",356400,4.99,https://down-vn.img.susercontent.com/file/vn-11134207-7ra0g-m6vagz164tif5a_tn
26257686830,TAIDU Cáp dữ liệu sạc nhanh bốn trong một hiệu quả và ổn định,49500,4.57,https://down-vn.img.susercontent.com/file/cn-11134207-7ras8-m2kqzdoxr55f4d_tn
24459693983,"VÍ NAM/NỮ DÀI CẦM TAY, CHẤT LIỆU DA SANG TRỌNG",29500,4.85,https://down-vn.img.susercontent.com/file/vn-11134207-7r98o-lqrca9d0aoya82_tn
23978207121,Kem đánh răng P/s các loại 180g,30800,4.92,https://down-vn.img.susercontent.com/file/vn-11134207-7r98o-lzbop9m23znxa7_tn
43950050157,"Nồi Cơm Tách Đường Jiwon JW-34F Dung Tích 1.2L, Nấu Ngon, Giảm Đường Hiệu Quả",1190000,5.0,https://down-vn.img.susercontent.com/file/vn-11134207-7ra0g-m9i99qwpp7b84c_tn
25882751602,Máy xay cầm tay đa năng SOKANY SK230A công suất cao 1000W với lưỡi dao Inox sắc bén bền bỉ,551500,5.0,https://down-vn.img.susercontent.com/file/vn-11134207-7r98o-lx0v4onzcb89a9_tn
24330675907,"Máy hút bụi PANTENE, Máy hút bụi cầm tay không dây lực hút siêu mạnh hút sạch mọi ngóc ngách trong nhà tiện lợi sử dụng",670800,5.0,https://down-vn.img.susercontent.com/file/vn-11134207-7r98o-lvbbuxe3x55w4c_tn
27712964222,"Máy Xay Công Nghiệp BARDEFU 3 Cối Xay Công Suất 8500W, Máy Xay Đa Năng, Xay Thịt, Xay Hạt, Xay Ngũ Cốc Siêu Khỏe",349000,5.0,https://down-vn.img.susercontent.com/file/vn-11134207-7ras8-m1tm4vqok43jf2_tn
25128380199,"Áo thun nam CHAPPER cổ tròn Hawaii, vải 280gsm thoáng mát - APCP019",319000,4.95,https://down-vn.img.susercontent.com/file/vn-11134207-7r98o-lv7flmpmq1ei09_tn
29701182716,Tương ớt CHIN-SU Sriracha 250g (Thơm Cay Ngon Thay Trái Ớt),25000,5.0,https://down-vn.img.susercontent.com/file/vn-11134207-7ras8-m1gnr0lm6z7je3_tn
25853535366,"Chảo vân đá chiên trứng chống dính cao cấp 4 ngăn, dùng cho mọi loại bếp tiện dụng cho gia đình",121500,4.47,https://down-vn.img.susercontent.com/file/vn-11134201-7ras8-m2atow2grm42a6_tn
29009279506,"Bếp nướng điện không khói 1500W , Kích thước 47x23cm Thiết kế gọn nhẹ, dễ vệ sinh mẫu mới 2024 - BH 1 Đổi 1",329000,4.63,https://down-vn.img.susercontent.com/file/vn-11134207-7r98o-lzlhkmttw1n1c3_tn
27201375155,"Máy Xay Thịt Inox Đa Năng Cối xay thịt thuỷ tinh Máy xay đa năng ăn dặm cho bé Dung tích 2L, 4 Lưỡi dao bằ",299000,4.68,https://down-vn.img.susercontent.com/file/vn-11134207-7r98o-lw9g6qu6uqxnb2_tn
23949450227,Bộ Đồ Bơi / Đồ Bơi / Bikini / lululemon / Quần Yoga (DG46) Cho Nữ,375840,5.0,https://down-vn.img.susercontent.com/file/cn-11134207-7qukw-ljnk4057k8m504_tn
23771851951,Loa Bluetooth Karaoke M2204 Kèm 2 Micro Không Dây Âm Thanh HD Bass Căng Bảo Hành Chính Hãng 12 Tháng,900000,4.89,https://down-vn.img.susercontent.com/file/vn-11134207-7qukw-lj0alnbtuy3061_tn
25435198820,Bộ phụ kiện máy ép chậm JIPLAITHEMIS JL-01 ( không vừa với bất kỳ hãng máy nào khác ),129000,4.88,https://down-vn.img.susercontent.com/file/vn-11134207-7r98o-lzas5f1924p94e_tn
29618870015,Túi vải máy hút bụi công nghiệp 3kW/5.5kW/7.5kW,125000,4.89,https://down-vn.img.susercontent.com/file/vn-11134207-7ra0g-m6zjbo6mwg9zf9_tn
29212129394,Máy Xay Hạt Khô Đa Năng Công Suất Lớn 300W MooLah Xay Bột Xay Ngũ Cốc Cafe Thảo Dược Các Loại Hạt Lưỡi 4 Cánh,305000,5.0,https://down-vn.img.susercontent.com/file/vn-11134207-7ras8-m33e7v8cvt3tcc_tn
25222371703,"500 cái khăn lạnh mini, không mùi",95000,5.0,https://down-vn.img.susercontent.com/file/vn-11134207-7r98o-lto3o5348s96f5_tn
20376964659,[Rẻ vô địch] Bộ đồ chơi dụng cụ nấu ăn 36 món Mini Kitchen Taby Toys DC05,189000,5.0,https://down-vn.img.susercontent.com/file/sg-11134201-7qvf7-lhxkvd2vez2821_tn
23955182870,"BỘ GẠT MƯA BOSCH AEROTWIN 24"" & 16"": MAZDA CX30 ĐỜI XE 2021 ĐẾN NAY",699000,5.0,https://down-vn.img.susercontent.com/file/vn-11134207-7ras8-m0xv8lhkzfovd5_tn
24910784607,Dụng cụ quấn dây điện gọn gàng dụng cụ giá đỡ cố định dây cáp cho các thiết bị gia đình tiện dụng kho giá gốc,3840,4.64,https://down-vn.img.susercontent.com/file/vn-11134211-7r98o-lqx8868maro92c_tn
16695805363,Sét 50 Túi Bóng Kính Hoạ Tiết Hình Ngôi Sao,9000,4.96,https://down-vn.img.susercontent.com/file/vn-11134207-7r98o-lktf4punys6z43_tn
19992599845,"Combo 10 Chén nhựa melamine dẻo đựng nước chấm, nước mắm,gia vị màu xanh tiện dụng",15000,4.8,https://down-vn.img.susercontent.com/file/vn-11134207-7r98o-ll588ktx3etk46_tn
29854617859,Đồ Chơi Lắp Ráp in 3D Mô Hình ROBOT FIGURE LUCKY DUMMY 13 với 11 màu sắc cung cấp bởi TDSTECH,27000,4.49,https://down-vn.img.susercontent.com/file/vn-11134207-7r98o-lxcksct1e47v81_tn
